comment_text,true_toxic,pred_toxic,prob_toxic,true_severe_toxic,pred_severe_toxic,prob_severe_toxic,true_obscene,pred_obscene,prob_obscene,true_threat,pred_threat,prob_threat,true_insult,pred_insult,prob_insult,true_identity_hate,pred_identity_hate,prob_identity_hate,num_true_labels,num_pred_labels,is_true_multilabel,is_pred_multilabel
""" I don't understand why my page was taken off. Bull shit I bet they be sucking alot of dick! My Page wasn't vandalism it was truthism. Look for you self: Espionage or a dick spying on some pussy lovers involves an individual obtaining information that is considered secret or confidential without the permission of the holder of the information. Espionage is inherently clandestine, as the legitimate holder of the information may change plans or take other countermeasures once it is known that the information is in unauthorized hands. See clandestine HUMINT for the basic concepts of such information collection, and subordinate articles such as clandestine HUMINT operational techniques and clandestine HUMINT asset recruiting for discussions of the """"tradecraft"""" used to collect this information. Hey I gotta joke and it goes like this:Dick says """"Hey Balls get ready for a patry"""" Balls replies """"You fucking liar. Everytime we go to a party, you always go in and leave us out here knockin. History Incidents of espionage are well documented throughout history. The ancient writings of Chinese and Indian military strategists such as Sun-Tzu and Chanakya contain information on deception and subversion. Chanakya's student Chandragupta Maurya, founder of the Maurya Empire, made use of assassinations, spies and secret agents, which are described in Chanakya's Arthasastra. The ancient Egyptians had a thoroughly developed system for the acquisition of intelligence, and the Hebrews used spies as well, as in the story of Rahab. Feudal Japan often used ninja to gather intelligence. More recently, spies played a significant part in Elizabethan England (see Francis Walsingham). Many modern espionage methods were well established even then. http://www.henrywotton.org.uk/ The Cold War involved intense espionage activity between the United States of America and its allies and the Soviet Union and the People's Republic of China and their allies, particularly related to nuclear weapons secrets. Recently, espionage agencies have targeted the illegal drug trade and those considered to be terrorists. Different intelligence services value certain intelligence collection techniques over others. The former Soviet Union, for example, preferred human sources over research in open sources, while the United States has tended to emphasize technological methods such as SIGINT and IMINT. Both Soviet political (KGB) and military intelligence (GRU ) officers were judged by the number of agents they recruited. Various Forms Unlike other forms of intelligence collection disciplines, espionage usually involves accessing the place where the desired information is stored, or accessing the people who know the information and will divulge it through some kind of subterfuge. There are exceptions to physical meetings, such as the Oslo Report, or the insistence of Robert Hanssen in never meeting the people to whom he was selling information. The US defines espionage towards itself as """"The act of obtaining, delivering, transmitting, communicating, or receiving information about the national defense with an intent, or reason to believe, that the information may be used to the injury of the United States or to the advantage of any foreign nation. Espionage is a violation of 18 United States Code 792-798 and Article 106, Uniform Code of Military Justice{{cite web | last = US Department of Defense | authorlink = U.S. Department of Defense | title = Joint Publication 1-02 Department of Defe",1,0,0.04782142413796538,0,0,0.0010186096593189707,1,0,0.036053984784145676,0,0,0.0005346769192119197,1,0,0.012716457630107104,0,0,0.002115940339926965,3,0,True,False
Hanibal911You're a bastard Pro-Assad.Hanibal911You're a bastard Pro-Assad.Hanibal911You're a bastard Pro-Assad.Hanibal911You're a bastard Pro-Assad.Hanibal911You're a bastard Pro-Assad.Hanibal911You're a bastard Pro-Assad.Hanibal911You're a bastard Pro-Assad.Hanibal911You're a bastard Pro-Assad.Hanibal911You're a bastard Pro-Assad.Hanibal911You're a bastard Pro-Assad.Hanibal911You're a bastard Pro-Assad.Hanibal911You're a bastard Pro-Assad.Hanibal911You're a bastard Pro-Assad.Hanibal911You're a bastard Pro-Assad.Hanibal911You're a bastard Pro-Assad.Hanibal911You're a bastard Pro-Assad.Hanibal911You're a bastard Pro-Assad.Hanibal911You're a bastard Pro-Assad.Hanibal911You're a bastard Pro-Assad.Hanibal911You're a bastard Pro-Assad.Hanibal911You're a bastard Pro-Assad.Hanibal911You're a bastard Pro-Assad.Hanibal911You're a bastard Pro-Assad.Hanibal911You're a bastard Pro-Assad.Hanibal911You're a bastard Pro-Assad.Hanibal911You're a bastard Pro-Assad.Hanibal911You're a bastard Pro-Assad.Hanibal911You're a bastard Pro-Assad.Hanibal911You're a bastard Pro-Assad.Hanibal911You're a bastard Pro-Assad.Hanibal911You're a bastard Pro-Assad.Hanibal911You're a bastard Pro-Assad.Hanibal911You're a bastard Pro-Assad.Hanibal911You're a bastard Pro-Assad.Hanibal911You're a bastard Pro-Assad.Hanibal911You're a bastard Pro-Assad.Hanibal911You're a bastard Pro-Assad.Hanibal911You're a bastard Pro-Assad.Hanibal911You're a bastard Pro-Assad.Hanibal911You're a bastard Pro-Assad.Hanibal911You're a bastard Pro-Assad.Hanibal911You're a bastard Pro-Assad.Hanibal911You're a bastard Pro-Assad.Hanibal911You're a bastard Pro-Assad.Hanibal911You're a bastard Pro-Assad.Hanibal911You're a bastard Pro-Assad.Hanibal911You're a bastard Pro-Assad.Hanibal911You're a bastard Pro-Assad.Hanibal911You're a bastard Pro-Assad.Hanibal911You're a bastard Pro-Assad.Hanibal911You're a bastard Pro-Assad.Hanibal911You're a bastard Pro-Assad.Hanibal911You're a bastard Pro-Assad.Hanibal911You're a bastard Pro-Assad.Hanibal911You're a bastard Pro-Assad.Hanibal911You're a bastard Pro-Assad.Hanibal911You're a bastard Pro-Assad.Hanibal911You're a bastard Pro-Assad.Hanibal911You're a bastard Pro-Assad.Hanibal911You're a bastard Pro-Assad.Hanibal911You're a bastard Pro-Assad.Hanibal911You're a bastard Pro-Assad.Hanibal911You're a bastard Pro-Assad.Hanibal911You're a bastard Pro-Assad.Hanibal911You're a bastard Pro-Assad.Hanibal911You're a bastard Pro-Assad.Hanibal911You're a bastard Pro-Assad.Hanibal911You're a bastard Pro-Assad.Hanibal911You're a bastard Pro-Assad.Hanibal911You're a bastard Pro-Assad.Hanibal911You're a bastard Pro-Assad.Hanibal911You're a bastard Pro-Assad.Hanibal911You're a bastard Pro-Assad.Hanibal911You're a bastard Pro-Assad.Hanibal911You're a bastard Pro-Assad.Hanibal911You're a bastard Pro-Assad.Hanibal911You're a bastard Pro-Assad.Hanibal911You're a bastard Pro-Assad.Hanibal911You're a bastard Pro-Assad.Hanibal911You're a bastard Pro-Assad.Hanibal911You're a bastard Pro-Assad.Hanibal911You're a bastard Pro-Assad.Hanibal911You're a bastard Pro-Assad.Hanibal911You're a bastard Pro-Assad.Hanibal911You're a bastard Pro-Assad.Hanibal911You're a bastard Pro-Assad.Hanibal911You're a bastard Pro-Assad.Hanibal911You're a bastard Pro-Assad.Hanibal911You're a bastard Pro-Assad.Hanibal911You're a bastard Pro-Assad.Hanibal911You're a bastard Pro-Assad.Hanibal911You're a bastard Pro-Assad.Hanibal911You're a bastard Pro-Assad.Hanibal911You're a bastard Pro-Assad.Hanibal911You're a bastard Pro-Assad.Hanibal911You're a bastard Pro-Assad.Hanibal911You're a bastard Pro-Assad.Hanibal911You're a bastard Pro-Assad.Hanibal911You're a bastard Pro-Assad.Hanibal911You're a bastard Pro-Assad.Hanibal911You're a bastard Pro-Assad.Hanibal911You're a bastard Pro-Assad.Hanibal911You're a bastard Pro-Assad.Hanibal911You're a bastard Pro-Assad.Hanibal911You're a bastard Pro-Assad.Hanibal911You're a bastard Pro-Assad.Hanibal911You're a bastard Pro-Assad.,1,0,0.48143743031738934,1,0,0.06733179795805438,1,0,0.33555843310045963,0,0,0.0031419400640904684,1,0,0.27141244312249324,0,0,0.010442659825343599,4,0,True,False
sexy time with old saggy grandmas,1,0,0.11293205243278254,0,0,0.00824156839531531,1,0,0.05808305356875826,0,0,0.0031822337454442706,1,0,0.051402099873978785,0,0,0.009030620622458681,3,0,True,False
Do you even know how much I've wasted for this crapp?,1,0,0.0785737922095979,0,0,0.006437400554117599,1,0,0.026987418125401008,0,0,0.00225756230169744,0,0,0.02398814987426101,0,0,0.005164375320743608,2,0,True,False
-also nederland is (relatively) a socialist country. we dont have the red on top our flag for no reason. but we sure as fuck arent communistic. and i fail to see any suffering our socialism has caused,1,0,0.2440489226076629,0,0,0.005611185192053704,0,0,0.1213269155526817,0,0,0.001484121212157936,0,0,0.046461000548033135,0,0,0.00797564437776684,1,0,False,False
""" WARNING - QUIT PUSHING POV'S IN THIS ENTRY This message is for several of you """"idiot fans"""" - either get on the same page or get the f***ing hell off of Wikipedia! Henceforth, I WILL be checking this entry from time to time throughout the day, and ANY mention of biased forums or other non-official sites WILL be deleted! Being a moderator does NOT mean you use that post to push your own agenda. Either keep is NPOV or supply info both pro AND con..... you CANNOT have it both ways.""",1,0,0.33524573115768386,0,0,0.003282918541098448,1,0,0.07209722575544733,0,0,0.0032649306872704164,0,0,0.09423671590167551,0,0,0.004258340741556223,2,0,True,False
"@Dp76764 I don't need rules and regulations of Wikipedia parroted back to me. I can read them for myself. I tried to come on here and kindly present my idea before publishing it, but it appears that diplomacy, as usual, has failed. I'm not here to vandalize anything and I'm not going to remove the atheism parts or anything else from the article, but I will include the fact that he was seen praying in this episode because it is relevant to the subject whether you like it or not. Please get yourself a life and try to remember that you don't own Wikipedia and that if you remove my submission or alter it in any nonconstructive way you will regret it. Fucker.",1,0,0.05682236272342304,0,0,0.001872498645010818,1,0,0.023346311499506882,0,0,0.0020055010113836104,0,0,0.01647906893112575,0,0,0.002374431009974791,2,0,True,False
""" UFC 191 You say """"LMAO"""", you use emojis, and your username says 1999 for no apparent reason? Your not fooling anyone, you 15-year-old brat. Stop vandalizing articles with your BS. I don't care if you thought it was obvious, your opinion versus official sources means absolutely nothing. Hit the bricks. """,1,0,0.41018588037800374,0,0,0.010433232647503007,0,0,0.07427035912966999,0,0,0.00646222326753853,0,0,0.10786416030333137,0,0,0.010230482094710915,1,0,False,False
"Tiresome is people who make false accusations of vandalism, and people who tell me to use the talk page when I already did. Kindly fuck off if you don't even have the basic courtesy to do what you so snottily ask others to do. 201.215.252.50",1,0,0.43338678539614833,0,0,0.010177572055748417,0,0,0.3088446862014411,0,0,0.002144302243846635,0,0,0.04566586655175116,0,0,0.006848606225908101,1,0,False,False
"You are clearly dumb, I already recieved the warning.",1,0,0.4700167149148238,0,0,0.02093199196937039,0,0,0.1334309089475235,0,0,0.003914947627722851,1,0,0.39995984607995505,0,0,0.01790855872488561,2,0,True,False
""" 75.3.64.232 has pictoral brown eyes then. Is 75.3.64.232 jealous she's not a Brown-Eyed Girl? (-: Remember the good times IP hopping around Chicago, Miss 75.3.64.232. But remember that only naturally brown eyes are attractive brown eyes. Blue eyes are """"brown"""" only when they're full of shit.""",1,0,0.35310253902933714,0,0,0.007882664569000967,1,0,0.09489884270176396,0,0,0.0018689659662034714,0,0,0.0605992138511087,0,0,0.013024034450004066,2,0,True,False
Your a moron everything is on the articles that are on the page. Yeah the ones that are actually legit or they still exist. And he doesnt have a birth certificate he says he's 14 its not proven even to this day,1,0,0.21264571966885837,0,0,0.002258707255281946,0,0,0.05676168301755158,0,0,0.0009101778528253835,0,0,0.0746914129806661,0,0,0.00647876108005618,1,0,False,False
""" Absolutely negative In absolutely no way. This user has been shown to been highly uncivil and arrogant. On a final note, please don't ever use the words """"fuck"""", """"fucked up"""", """"crap"""" and """"idiocy"""" when you are debating with other editors. It only weakens your position and it is strictly against the rules on here. As to my own earlier comments, on reading them a second time, I feel that I may have been uncivil towards you by writing """"In fact if you are ..."""". So you have my apologies on that. It does not however change my position that the file is perfectly valid for use on this article. By the way I do not hate you, I just find your reasoning to be illogical. Green Giant I have knowledge in this area and citation should be provided where asked for and orginal research flagged up where spotted. """,1,0,0.33627179273793145,0,0,0.001661416394752463,1,0,0.13908842313714537,0,0,0.0018541991643729557,0,0,0.029954184802556124,0,0,0.00341386218531307,2,0,True,False
"Hello Hey there Metros. You know me. Why pretend you don't, bitchy poo? Who else is a beeg fan of beeg mooonster poonag?",1,0,0.2505622688296759,0,0,0.013792315828169704,0,0,0.06466743614797359,0,0,0.00508215227270815,0,0,0.09855603489731544,0,0,0.013786098224991142,1,0,False,False
edit filter disturbs i can't add a gay userbox to your userpage,1,0,0.24460070668721512,0,0,0.012489199267901839,0,0,0.033821991991413,0,0,0.003999284012470794,0,0,0.09311112026746828,1,0,0.05497811243393624,2,0,True,False
"ENOUGH! You don't own Wikipedia, so quit bothering me!",1,0,0.2825600468986782,0,0,0.01201463149570402,0,0,0.09545750498199285,0,0,0.0036532122790896874,0,0,0.08806559734117293,0,0,0.013457800636131117,1,0,False,False
"how in the hell can you be part muslim? that's a religion, not a race. what a stupid statement. some days he prays to Allah, other days he prays to God? my race is catholic and i'm a practicing italian? or am i part lutheran and part jewish? are people really that ignorant? RELIGION DOES NOT EQUAL RACE. i can't believe that some people don't know the difference.",1,0,0.45249123499455574,0,0,0.004199191699120054,0,0,0.06554975768330545,0,0,0.0022171977526115735,0,0,0.1207886876859154,0,0,0.03764600321042653,1,0,False,False
WHO CARES.... GOETHEAN IS A capuchin monkeys anyway,1,0,0.20572996793702003,0,0,0.013491793447522734,0,0,0.06103932432071011,0,0,0.002128482605072101,0,0,0.07062987629920006,0,0,0.022887146721328053,1,0,False,False
Silence! Don't message on my talk page. I am going to erase all your messages because you told me tp go away so Silence! Not another word!,1,0,0.40280965582638056,0,0,0.009931174665646973,0,0,0.1047006440640337,0,0,0.012708972040317264,0,0,0.07812966896307462,0,0,0.006950129900815622,1,0,False,False
Comment What the heck are you talking about?,1,0,0.31798159794841524,0,0,0.005821327521919505,0,0,0.08919209416325216,0,0,0.002802038276049497,0,0,0.0408091148161314,0,0,0.007303547592906486,1,0,False,False
BONGWARRIOR WHY YOU GOTTA HATE,1,0,0.4868163179147467,0,0,0.021709887889855225,0,0,0.10869096831314841,0,0,0.006306191650643688,0,0,0.10030649142350351,0,0,0.07808926462574645,1,0,False,False
That was some ugly juvenile vandalism. Kids these days...,1,0,0.1803164331443249,0,0,0.005904920155516896,0,0,0.026860408532949024,0,0,0.0017379312702236218,0,0,0.09076842361378529,0,0,0.006819782839780805,1,0,False,False
""" Without playing your silly game no more, I'll just skip to the point and suggest a new sentence: """"This argument has been cited by most American physical and cultural anthropologists as evidence that racial categories are biologically meaningless, and that behavioral differences between groups cannot have any genetic underpinnings. Physical and cultural anthropologists in other countries, most notably Russia and China are mostly of the opposite opinion, and believe racial categories are biologically meaningful. Likewise, the majority of forensic anthropologists, biologists and developmental psychologists believe race is biologically meaningful."""" """,1,0,0.02236432839227425,0,0,0.0019500721682046075,0,0,0.009013074872670845,0,0,0.0016542180603098184,0,0,0.009649296057494051,0,0,0.0053848647807362695,1,0,False,False
"How do you get semen stains off jeans? How do you get semen stains off jeans? - Tim, 20 July, 2009",1,0,0.3968943983866303,0,0,0.02005360085594379,0,0,0.2884194009879907,0,0,0.006008833821468621,0,0,0.09997202506850704,0,0,0.017567542754044613,1,0,False,False
"Wikipedia:Headless Chickens I have nominated your headless chicken page for deletion as it is useless. Lets hope it gets deleted, yes.",1,0,0.058851418015112074,0,0,0.005744107593390176,0,0,0.01161998601966682,0,0,0.001974717989971282,0,0,0.01827787133965553,0,0,0.0035213648540763933,1,0,False,False
How ironic since the first thing you did when you met me was accuse me of being a sockpuppet...hypocrite.,1,0,0.3133479147871494,0,0,0.006813336446163602,0,0,0.03887059913959805,0,0,0.002522085177182411,1,0,0.08247132760265859,0,0,0.0044384538871718145,2,0,True,False
"in other words, don't use the word a s s with the letters back-to-back because it sends up a red f u c k i n g flag to the computer reader.",1,0,0.03167865017432986,0,0,0.0025598098172108924,1,0,0.020166106994006932,0,0,0.0013178782179561362,0,0,0.00997596914512416,0,0,0.003014311753328496,2,0,True,False
"WELL SAID Loremaster you do not own the article, you tyrannical anti-knowledge hater.",1,0,0.24459186955082593,0,0,0.007425512721492427,0,0,0.028549344096779894,0,0,0.003196535406269863,0,0,0.05591967223083794,0,0,0.018455569080505066,1,0,False,False
unblock|its MY TALK PAGE . HELLO CAN YOU NOT SEE THAT. I AM SHELBY YOUNG AND I WANT MY NAME OFF THIS WEBSITE AND PER JIM WALES I CAN REMOVE BOTH THE IP ADDRESS AND MY TALK PAGE SO GTFO. Blocking me won't do anything but make me call Jim. I suggest you read his talk page. Sick of pervert child molestors stalking me around wikipedia.,1,0,0.2952689211950946,0,0,0.007439882961440021,0,0,0.04623627431817522,0,0,0.003007491978991566,1,0,0.03329075383998062,0,0,0.0034268251040702764,2,0,True,False
little douchebag... ...you gonna wish you didn't start it,1,0,0.4822816791159361,0,0,0.024632056124696326,0,0,0.1951842842734117,0,0,0.014215841999192149,1,0,0.2955593059796378,0,0,0.014400116061314628,2,0,True,False
stop As wiki is not a Waabi and deobandi Platform so don't try ur sick Views here.First collect correct information and be on siratal mustakeem. (t • c),1,0,0.2187044839602274,0,0,0.004971110970966127,0,0,0.03894069286471914,0,0,0.0020187287748385783,0,0,0.049147413757737714,0,0,0.007992919688662847,1,0,False,False
"Butthurt sandpeople, please don't censor Jewish articles.",1,0,0.04325279023810539,0,0,0.0038225953669172594,0,0,0.01534981121528533,0,0,0.0019093877970446933,0,0,0.01835571466337901,0,0,0.01703414225287337,1,0,False,False
"i'm a doctor of journalism, for chris'sakes... i don't even know why i'm wasting my time with this chicken-shit, cheapjack little myth-site anyway... there are WAAAAAAAAY better syph lists on the web, BELIEVE me... just thought i'd do y'all a favor, & share some honest medical facts—make this shoddy, incomplete list a BIT more comprehensive, perhaps, but what do you know—I was merely WASTING MY TIME! ... AGAIN!",1,0,0.10171835420377741,0,0,0.0063986548321185305,0,0,0.08969343926395693,0,0,0.0014324022537685359,0,0,0.03801286819903121,0,0,0.006389821016773501,1,0,False,False
""" You started the """"edit war"""", son. Try not being a southern-fried liar and labeling constructive edits as """"vandalism"""". HAND; FYM. """,1,0,0.17432124824701076,0,0,0.005278302527910573,0,0,0.02791050411638582,0,0,0.0023369742625680835,0,0,0.0529166264737523,0,0,0.005471154299745407,1,0,False,False
I really hope you faggots know how to swim because you are going into the lake of fire...lol I hope there is a balcony in heaven so that I can look over the side and see you swimming in the flames.....No kidding -),1,0,0.12941292433163443,0,0,0.005160104879501009,0,0,0.04417561512194355,0,0,0.007314682082372935,0,0,0.06836333297446402,0,0,0.009582301371303401,1,0,False,False
"OKAY IGNORE THAT,THAT WAS CRAP OK DON'T TRY THIS AT HOME YOU WILL GO TO FEDERAL PRISON",1,0,0.4133898033132207,0,0,0.006064651271046604,1,0,0.11224485687410488,0,0,0.004869582742206415,0,0,0.09243585020902015,0,0,0.005460192183235605,2,0,True,False
You're an asshole. Seriously. I've been here for three years. I know edit summaries are encouraged. But I've never heard that it is encouraged that we revert articles simply because no edit summary is provided. That's ridiculous.,1,0,0.23078032728302425,0,0,0.005238889362200917,1,0,0.10297850603718363,0,0,0.0012873083328345614,0,0,0.11848157213298613,0,0,0.004184566967349597,2,0,True,False
theres a fat kid in my history class who looks like raul lawl. omg it rhymes.,1,0,0.22814170381874482,0,0,0.009608498135408735,0,0,0.07831765837769544,0,0,0.0027901948889752317,1,0,0.07350358407993278,0,0,0.01258710822891222,2,0,True,False
Get that bullshit outta here. You completyely ignore the other links which state that Savage brought the situation into mainstream thought before anyone else did. Both links are by left-wing liberals who have no agenda to give Savage credit yet they DO give him credit.,1,0,0.13351254276832977,0,0,0.0034780228414846024,1,0,0.0722352141686526,0,0,0.0014446108418878912,1,0,0.027517586175619738,0,0,0.005696643976940447,3,0,True,False
"Take a look at the history page and how many times it's been edited This article needs semi-protection from the admins themselves! Our great history, the history of the one of the oldest european folks has been vandalized by a bunch of greek and turk morons who replace our original history with their cancerous neo-turkic crap! Now I understand why wikipedia is forbidden to be cited in academic and and scientific researches - because of idiots like this moron jingibingy who is nothing more than a vandal and deserves a serious punishment. Hey, jingy, don't forget that the Bulgarians never forgive their enemies!!! Remember! You can run, but you can't hide! Not even in London. I said.",1,0,0.46471645356736996,0,0,0.0018980912795070453,0,0,0.07540846471973325,0,0,0.000739990277574934,0,0,0.11539471452607908,0,0,0.00444471427415117,1,0,False,False
AINT DAT A BIT RACIALIST?,1,0,0.13473406388880962,0,0,0.008303193988036594,0,0,0.03155667100381495,0,0,0.002797779956809506,0,0,0.03651455177682363,0,0,0.006370989695394505,1,0,False,False
"Married to a Japanese? Wait, so are you attracted to people from other human races? Chanes are, you have sexual deviations, eh? How about mating with a couple of two happy homosexual monkeys?",1,0,0.24271704031315455,0,0,0.008926642965780208,0,0,0.04010330561529212,0,0,0.002680188550602455,1,0,0.07454601495301158,0,0,0.06668605579400592,2,0,True,False
"Yes, I was blocked for losing patience with you, and what I did then would constitute personal attack. Honest outspoken criticism that is based on fact is permitted though, and the shameless hate speech expressed here deserves more than just vocal criticism. As for you, I'll discuss you elsewhere. This isn't the place for that.",1,0,0.08856131670709255,0,0,0.0032136616367599517,0,0,0.01643019332168994,0,0,0.002622798330884738,0,0,0.0224137692526694,0,0,0.0040508048125454405,1,0,False,False
why is a book with sex and hardcore orgys a childrens book why is a book with sex and hardcore orgys a childrens book. do many childrens books have orgys and hardcore porn (i wish!) no they are clean unlike this book. which is full os sex. its a can of sex,1,0,0.3096846848305864,0,0,0.008112768468493528,1,0,0.03926085203795832,0,0,0.001630135603597749,0,0,0.023326466027139284,0,0,0.01107083975587379,2,0,True,False
""" BREAKING NEWS!!!! I KNOW THIS IS ONLY FOR THE FRONT PAGE, BUT THIS DESERVES IT!!!!!!!!!! Okay. First let me start off by saying that people DO post breaking news, etc. on here. Like t on sept 11th 2001, etc. Anyway there is this new website called """"i-doser.com"""" where you can virtually take drugs, such as marijuana, heroin, pills to make it so you can have lucid dreams, etc."""" People this is extremely serious. I mean we have to make like an article about this or SOMEHTING. Hello you idiots. I mean what if little 8 year olds kids do this eh? WE are going to make an article about this. Let's discuss it here. """,1,0,0.04675038236835928,0,0,0.0017333781443784686,0,0,0.021895671428775316,0,0,0.0008811986554759556,0,0,0.032804342295356344,0,0,0.00251250150597218,1,0,False,False
