comment_text,true_toxic,pred_toxic,prob_toxic,true_severe_toxic,pred_severe_toxic,prob_severe_toxic,true_obscene,pred_obscene,prob_obscene,true_threat,pred_threat,prob_threat,true_insult,pred_insult,prob_insult,true_identity_hate,pred_identity_hate,prob_identity_hate,num_true_labels,num_pred_labels,is_true_multilabel,is_pred_multilabel
oh wow a block im so scared. <sarcasm. stop getting all butt hurt bro. your threats don't faze me. you're just wasting your time getting all shook up over nothing,0,1,0.9278823520562648,0,0,0.03746936378615031,0,1,0.5391812417755911,0,0,0.012701386101411588,0,0,0.3632448073554408,0,0,0.03250013604517809,0,2,False,True
Block Why do you say someone is idiotic and ban them for personal attatcks when calling someone idiotic is a personal attack? Shouldnt you be banned? I suppose not because this is not a democracy on this site its run like Hitler ran Germany.,0,1,0.7510641264437934,0,0,0.004073159532857441,0,0,0.10043747822956714,0,0,0.001738386998576911,0,0,0.18931556953229534,0,0,0.008772388706876466,0,1,False,False
Your a disgrace Dan stop making up silly stuff about the wombats,0,1,0.5379650468033624,0,0,0.00664433155530511,0,0,0.03890255568865283,0,0,0.003144892714242545,0,0,0.04731060840617426,0,0,0.006869012494890375,0,1,False,False
Get a life and quit stalking me. You admin clowns need to move out of your parents basements and get some real life experience in human interaction.,0,1,0.5818541434450819,0,0,0.012889767328455403,0,0,0.13309762875156608,0,0,0.009249163201342484,0,0,0.21273207084691428,0,0,0.01917799502011538,0,1,False,False
"Have U no decency you have insulted my people, my nation and my ancestors and refulte that fact that I AM WRONG, the one that lives in Ireland is wrong I DON'T think so. Yes you are a ballbag (scrotum or testacles) because you seem to think that i am going to lie down and take this crap without a fight becuase you have this notion in your head that you are wikipedia and that you think you know everything. I happen to have a degree in Irish history and poltics so don't try and preach to me on these matters. I think an apology is in order for your insults and disgraceful remarks.",0,1,0.5420267722563812,0,0,0.004067861067319587,0,0,0.07118607939044728,0,0,0.01082074504140716,0,0,0.09317320261473823,0,0,0.00864908645689069,0,1,False,False
Rename to corn This maize crap has gone on long enough. its CORN and the sooner you idiots let go of your anti-American hysteria the better. 184.4.141.73,0,1,0.6960262269574665,0,0,0.010277256185859658,1,0,0.16849842617996924,0,0,0.003065150061532091,1,0,0.19606738101119203,1,0,0.013710620165091498,3,1,True,False
"Why do not the two of you, the mentally retarded Jennygirl and the omnipotent Richie Rich, go together to Harrods and dont forget to choose together, being an authentically healthy and sociable couple, time and location, maybe a restaurant,and then enjoy very evidentliy your meal and in case you should discover that you cant pay anymore, then do not expect them to let one of you peel the potatoes in return. Maybe they wont even say Hello when you come back after they would be kicking off your dipshit spinning incapable ass from the central perk. What a pitty. You have all of my sympathy on your side. Enjoy yourselves and your longest sentence Johnny-come-lately programme director.",0,1,0.6319411530896454,0,0,0.015526879100285312,0,0,0.2954339105791689,0,0,0.013398077864419083,0,0,0.45075719964999794,0,0,0.02122818866457698,0,1,False,False
YOU PEOPLE STOP ATTACKING AND TELLING LIES ABOUT ĴEWS.,0,1,0.5995705459456248,0,0,0.01949951080684573,0,0,0.0618507787464692,0,0,0.005309764326426421,0,0,0.12548898857144103,0,0,0.015614291239130792,0,1,False,False
And I don't give a damn.,0,1,0.7056452158780034,0,0,0.01603944655600909,1,1,0.5022422774856689,0,0,0.003321268953193354,0,0,0.10528699681347217,0,0,0.013499951299106507,1,2,False,True
""" Now hear this Somchai Sun cracker. Some of us here on Wikipedia are not caught up in the racist swindle of using the word """"Islamism"""". There is nothing wrong with wanting to delete this page -that is not censorship but respect for encyclopedic knowledge, whereas you worshiper of authority want to kiss the ass of all the white scum anti-Muslim pro-war, intellectual nobodies, who want to turn wikipedia into the National Enquirer or some kind of British tabloid. We won't stand for it so don't bother coming back you simple anti-Semitic pseudo-journalistic charlatan!!! - 31 July, 2014""",0,1,0.5697827690817099,0,0,0.0029557710506301483,0,0,0.20254247805332293,0,0,0.0015193308523244026,1,0,0.15276143459374938,1,0,0.02368161941633816,2,1,True,False
These are construtive changes. You are just a troll.,0,1,0.5537935346947366,0,0,0.009707102595516952,0,0,0.04794881450961043,0,0,0.002968945286556575,0,0,0.15911691024139202,0,0,0.016854434643319528,0,1,False,False
"Hey, im ripped as hell man",0,1,0.7005572946989966,0,0,0.02486071386350515,0,0,0.28964549672916584,0,0,0.007709313320837295,0,0,0.20509532949477555,0,0,0.04094112047682185,0,1,False,False
""" So the loser group of editors who elected you in the first place is going to recall you. You make me laugh. How about you voluntarily resign and let us re-elect you? Oh, you're too much of a coward to do that? You'd rather attack me instead? Demand an apology? You make me laugh. I pity your moral reasoning. Talk• Contributions """,0,1,0.7665276421845375,0,0,0.016814895187706885,0,0,0.1618435324740251,0,0,0.00993398434971786,0,0,0.37308498437806276,0,0,0.008674458294782425,0,1,False,False
"??? == I didn't attack you, you weirdo! ==",0,1,0.6639480577705213,0,0,0.054327675653077244,0,0,0.21868915586130708,0,0,0.013349239694833547,1,0,0.3370007262005547,0,0,0.011651440785044001,1,1,False,False
Fine Arse. Foul mouth. What more do you want.,0,1,0.5360310348761983,0,0,0.021247153362563595,0,0,0.24658717758655177,0,0,0.00341432018782653,1,0,0.16504309861667762,0,0,0.018291066748554314,1,1,False,False
"stop pretending Stop pretending to be cool. I don't really care what you do. Go ahead and ban me, I can change my IP in less than 5 seconds or I can use 1 of the thousands of spoofs, vpns, etc, etc. I don't even have to close my browser to do it. You should also know that even if you vandalize my IP user page, I'm still not going to read your reply. Do yourself a favor and go fuck your wife before somebody else does. 1, 2, 3, 4. Let's have an edit war. You guys should really learn some manners instead of surfing wiki pretending to be a badass. This edit thing is really easy.",0,1,0.5333688406983251,0,0,0.008266630530152573,1,0,0.24287660163144292,0,0,0.003774854171476691,0,0,0.1019490460361653,0,0,0.005632896784630561,1,1,False,False
"Aw. Little InaMaka got tired of playing. Wikipedia is so boring without you. Hugs and kisses. Your BFF,",0,1,0.5599093316458041,0,0,0.012418010187697627,0,0,0.13339278834826762,0,0,0.0037795032926818397,0,0,0.1079345960460887,0,0,0.01662159840276711,0,1,False,False
I have provided you by some new info regarding falsetto which wankers like 4meter4 cannot acceept simply because they think they know everything. I do not get shit about wikipedia any more because you are unable to avoid wankers like 4meter4. Feel free to mention the shit around the world. Feel free to block me for ever!,0,1,0.6555922292801942,0,0,0.01196426661113444,0,0,0.304682731229072,0,0,0.002367485042536899,0,0,0.11994639786104033,0,0,0.013075735408095078,0,1,False,False
WE ARE GOING TO MAKE SURE YOU ARE EXPOSED!! DROP YOUR RELATIONS WITH ANTI AMERICAN HATE GROUPS 'WE ARE GOING TO MAKE SURE YOU ARE EXPOSED!! DROP YOUR RELATIONS WITH ANTI AMERICAN HATE GROUWE ARE GOING TO MAKE SURE YOU ARE EXPOSED!! DROP YOUR RELATIONS WITH ANTI AMERICAN HATE GROUPS 'WE ARE GOING TO MAKE SURE YOU ARE EXPOSED!! DROP YOUR RELATIONS WITH ANTI AMERICAN HATE GROUPSPS,0,1,0.5462145388869872,0,0,0.013881973784749703,0,0,0.03719977125050174,0,0,0.01566107319996933,0,0,0.08576133679709248,0,0,0.03909647555768593,0,1,False,False
""" oh ha ha ha, ain't you funny. - T:C """,0,1,0.6492947464339257,0,0,0.02694322842592206,0,0,0.1725966900804177,0,0,0.0027760660816289764,0,0,0.22703529106465173,0,0,0.021282260417976935,0,1,False,False
"""-skinned prick named OlYeller got me banned. He doesn't like it when people point out that he broke his promise: """"finding 2+ news articles from reliable and independent sources would shut me up. If you do that, I'll make the text say annual myself."""" http://en.wikipedia.org/w/index.php?title=Talk:Everybody_Draw_Mohammed_Day&diff;=prev&oldid;=425928499 You're a lying piece of shit, OlYeller.""",0,1,0.5060250121388791,0,0,0.011066015947550073,0,0,0.23392850524724973,0,0,0.004158618262785939,0,0,0.11238024977885193,0,0,0.009444567356764322,0,1,False,False
"Just for clarification you're a cock. Congrats on having software that can detect IP changers. Glad I only got it on the trial. No, you really are a cock.",0,1,0.6145307758489015,0,0,0.014744882688630473,1,0,0.2738872606018097,0,0,0.0015464456095911963,1,0,0.15642992685851692,0,0,0.01185578485136509,2,1,True,False
""" Hey , don't you tell me what to do, or where to go, got it? Oh, and if Wikipedia is your """"business"""", then you really need to get a life! """,0,1,0.6452309644820058,0,0,0.01616560832395229,0,0,0.2621044395769944,0,0,0.008788593898850927,0,0,0.2781873163302275,0,0,0.013741794769354464,0,1,False,False
renault you sad little bo for driving a renault clio which has no vaa voom so there and the mcflurry is made of shit,0,1,0.767128660324977,0,0,0.012771729422295737,1,0,0.4938424654908323,0,0,0.002868000818955574,1,0,0.2071614499482837,0,0,0.02094645984831572,2,1,True,False
The worst school ever..,0,1,0.5766512292882789,0,0,0.007896683337447266,0,0,0.03498727753149564,0,0,0.0020580228868865716,0,0,0.13038352234615072,0,0,0.00801961890664613,0,1,False,False
""" John Mark Karr quote """"You wanna rape us John Mark Karrs? You wanna rape us Debra Lafaves? Fuck you."""" The source cited has the entire word before """"you"""" blotted out. Is there an uncensored source, or are we just assuming it is """"fuck""""? Although it would make the most sense from context, to be sure, we cannot make such an assumption in an encyclopedia. Either the word should be blotted out or a reliable, first-hand, uncensored source must be added.""",0,1,0.5385972019913166,0,0,0.013380668092167406,1,0,0.4502068305219098,0,0,0.005160990533826293,0,0,0.09406885070681915,0,0,0.009176885924200278,1,1,False,False
(YOU ARE FAGS) I AM LEVEL 2 OF LEVEL 2 AND YOU ARE STILL FAGS Menergy Energy for MEN,0,1,0.5369663612334815,0,0,0.014043332993980062,0,0,0.10728775857137451,0,0,0.004939653121061201,0,0,0.13088549993091067,0,0,0.021436855102144367,0,1,False,False
""" Honestly, that was not """"threats of harassment"""", maybe it sounds like it... but you don't know about the actual situation and what happened in the past. GVnayR is a very """"dangerous"""" Wikipedian, I can deepen it. I'm editing Wikipedia since 2010 and I can say that he is the lamest, weirdest, most """"dangerous"""", etc. In my opinion being blocked indefinitely because of this is not fair (1~2 months is more fair). Sadly, blocking this user Hydao (who always fought against vandalism and addition of nonsense things) will not solve the problem. Sooner, the user GVnayR will start adding completely stupid and nonsense things on Wikipedia, which is unacceptable. I will continue fighting against vandalism and nonsense stuff (added by losers/nolifers like GVnayR), with or without """"Hydao"""". Now you are thinking: """"Hydao, you are insulting a user by calling """"loser and no-lifer"""", but that's not an insult, it's just the reality. A high-functioning autistic who doesn't work, doesn't have a job, doesn't have friends, use the government pension to buy PlayStation games and pay the Internet bill, someone who spend his days/months/years doing NOTHING useful (except making frequently STUPID edits on Wikipedia and wasting other ppl PRECIOUS time...) is a big loser who needs a LIFE LESSON. I don't mind if this """"Hydao"""" is blocked, the only thing I know is that GVnayR needs an """"ULTIMATE LESSON"""". Well, at least I can say that Hydao """"died"""" or is """"dying"""" for a decent/noble cause. """,0,1,0.5978413156031319,0,0,0.0009650194976579786,0,0,0.05518259200121393,0,0,0.0008198029437520428,0,0,0.1247206504738375,0,0,0.0033682174121180374,0,1,False,False
"Outrageous!!!!! This block is outrageous and un-Wiki! Lauren Caitlin is about a TRILLION times more important, beloved and prominent than at least 99% of all the article subjects on this joke of a site. WHY, OH WHY, are Wikipedia's administrators so freaking a***-retentive and have such an inferiority complex and fragile egos??? Do all of you HAVE TO ruin the fun and enthusiasm of the rest of us members JUST BECAUSE you need to feel powerful and important so desperately?? Are all of you school marm librarian types in wool sweaters with thick glasses, afraid of the thought of romance and fun? SHEESH. This Lauren Caitlin Upton Bio page better be approved quickly and available for work. America can't wait any longer for the Wikipedia Administrator Moron Club and assorted other freak Wikipedia unions to get a life. Don't you people have JOBS, or do you just play with yourselves here while you're playing with and tormenting the rest of us contributors?",0,1,0.5347070969658548,0,0,0.00445226438810927,0,0,0.08714689105839064,0,0,0.0015183185672928456,0,0,0.1532459013272431,0,0,0.009078706737115924,0,1,False,False
NO I HATE IT BECAUSE YOU DELETE EVERYTHING,0,1,0.625011317621007,0,0,0.011265038882650026,0,0,0.06231991102059451,0,0,0.0064418673842888225,0,0,0.06705207302504647,0,0,0.040341823786503486,0,1,False,False
wtf what is your problem with me are you a stalker,0,1,0.8122992243248761,0,0,0.01569563553935993,0,0,0.2572229279453992,0,0,0.0057505723808199145,0,0,0.23593950262283958,0,0,0.013986443927138145,0,1,False,False
""" is not interpretation to point out racism in obvious racist comment. is simple statement of fact. is like saying comment of """"black people are lazy"""" is not racist because interpretation necessary. ridiculous whitewashing. """,0,1,0.5347352468501279,0,0,0.003122076699915792,0,0,0.03166265005824732,0,0,0.0010152405049866742,0,0,0.0763116520626929,0,0,0.059069863811880056,0,1,False,False
"Oh yeah, if you're too lazy to fix the tags yourself, and letting a bot do all your work, you're supporting artifical intelligences' universal takeover in 2020. Stop it. Kill it now.",0,1,0.5980424791945236,0,0,0.01612455485156476,0,0,0.09866843838104515,0,0,0.013483602801619346,0,0,0.14973659783796392,0,0,0.014798757372103703,0,1,False,False
"Stop Stop Being Rude to users who don't sock this wiki.Thanks,yours truly,68.84.225.186",0,1,0.5133575472008671,0,0,0.005990375098222767,0,0,0.08941629964444775,0,0,0.0023891268528880645,0,0,0.10210695524615711,0,0,0.007076488343958323,0,1,False,False
.... Screw YOU...shitbag,0,1,0.8472583860086779,0,0,0.018242172988856716,1,0,0.21752286840760446,0,0,0.005188546868233965,1,0,0.2671561805708323,0,0,0.009500469390875286,2,1,True,False
"What's the Deal? you say i'm harrassing, but your doing everything u can do to get rid of to page AFTER theres proof. and then you undid my change from redirecting Daishocon to Daisho Con. they had me switch it around because they prefer it to have the spaces. so WHY do you want to get rid of this page so bad. apparently you really dont like anime if your trying to get rid of an anime convention page. your trying to bully around someone who you have no reason to because ur a little net moderator. wow. seriously. tell me, what is your problem with me, and what is your problem with Daisho Con? tell me like a man.",0,1,0.5018047256675363,0,0,0.008671436022514484,0,0,0.2474707847523209,0,0,0.0035315536823784834,0,0,0.21045369766020483,0,0,0.012613083940410537,0,1,False,False
Mr.Checkon == This man deserve mention but some fag admin keeps deleting it. ==,0,1,0.513818058222965,0,0,0.008535517909961063,0,0,0.1481927202885771,0,0,0.0030867880491689407,0,0,0.13602491559812616,0,0,0.022750737286721,0,1,False,False
Are you his mother?,0,1,0.6226216109264672,0,0,0.0271973076969563,0,0,0.17402014201969085,0,0,0.006985190785769543,0,0,0.2584466170106631,0,0,0.03481841134851398,0,1,False,False
"WTH DUDE Deleting my articles, you got no bloody right! how would you like it? you power mad freak! Come out from hiding behind your computer screen!",0,1,0.8199090599023877,0,0,0.02985181606252186,0,0,0.18864480174229312,0,0,0.009108835338303402,1,0,0.3157287155438879,0,0,0.020504785738605574,1,1,False,False
""" What a crock of shit, . That's the pissiest, poorest logic I've ever seen. What group do you belong to? The shortbussers? Diligent Terrier may be a dick, but I'll say one thing for him, he's A-100% ethical and honest in all his dealings. And I don't think he ever found himself lost in a bathroom stall, which I doubt you can claim. To insinuate that what DT did constituted a """"personal attack"""" constitutes a huge case of self-embarrassment on your part. It's just ridiculous.68.218.222.40 """,0,1,0.6049268102924173,0,0,0.0050230122727131345,1,0,0.20214434048059274,0,0,0.002759062984063186,0,0,0.11251229065642514,0,0,0.00754818339888955,1,1,False,False
"I have just read your userboxes and your userpage And frankly I am revolted by you. You appear to be a disgusting specimen, and I will gladly put you out of your misery! 86.7.18.55",0,1,0.6270636243061144,0,0,0.027038747406565793,0,0,0.1708824961058674,0,0,0.030352023381099262,1,0,0.1765280515547295,0,0,0.01859338033467114,1,1,False,False
Oh my god... You are so gullible. adds you to Gullible Wikipedians list* I cannot believe you actually fell for this. HA! - S-man,0,1,0.515691589911253,0,0,0.0157617145987322,0,0,0.15883992424824947,0,0,0.004265489331451796,0,0,0.18574686728989961,0,0,0.023084642558594957,0,1,False,False
"Wikistalker and sock puppet Lay off. I will have recourse. You are not immune. Stan You have continued in your harassment, and have now admitted that you were guilty as charged. I have reported your misconduct. You should know better. Indeed, your wiping out my complaint carries with it your admission, and your attempt to cover up what you have done. From your talk page, this is apparently not your first time. This is your last warning. Stan",0,1,0.5097112198290634,0,0,0.009078116443546232,0,0,0.10444127448840931,0,0,0.014175844505942566,0,0,0.12606753782496136,0,0,0.006332456832025252,0,1,False,False
ThisYou are 22 years older than your husband! You are an old cougar!ions,0,1,0.526327068996968,0,0,0.013254960418543443,0,0,0.060365200169567375,0,0,0.003865426581339706,0,0,0.344911802165495,0,0,0.021215744627393382,0,1,False,False
"It's okay, I am happy you did not delete it, this way everyone knows the whole story of vindictive people and their pathetic life, who must pick on sick and disabled children. THANKS!",0,1,0.5402351807819968,0,0,0.004735890844609246,0,0,0.07346418138974056,0,0,0.0027908571032258683,0,0,0.16749643234550998,0,0,0.009794809155827448,0,1,False,False
"Hi Dear Sikhs, I would request all you all to please help me in exposing Sikh Scholar, who actually is an RSS sponsered person pretending to be Sikh, please see below the kind of statements he makes to me Wow wow so the truth is finaly out....you have spoken like a true Hindu RSS wala......is that the way a scholar speaks...wow...(my answere to him) (Sikh Scholars comments to me)....... stupid dumb FU*K MY great great great great grandfather was Mani Singh the greatest of Sikh matrys. Its scum like you that needs to be executed. You deserve execution - you stupid dumb fu*k everyone in my family over 500 members are Baptized Khalsa SIKHS. We have been Khalsa Sikhs for over 300 years you dumb fu*ker. Because you have insulted me and broken the teachings of the Guru Granth Sahib you deserve death -you dumb fu*ker.Sikh scholar (talk) (my answere to him)...Now I will be after you to expose all your RSS gang pretending to be Sikhs and being some kind of expert in Sikh religion...it my promise to you Fake scholar... He is being supported by few other RSS sponsered members in Wikipedia with regards to SINGH article here.",0,1,0.6084575228762673,0,0,0.010956689774751682,0,0,0.36291427660041303,0,0,0.010329128260405438,0,0,0.494818925330892,0,0,0.015931701805457298,0,1,False,False
"hey im cattygirl, i know that you are John. where do you live sweety? i think i like you",0,1,0.6816751101795575,0,0,0.03417954024619728,0,0,0.24937163332320897,0,0,0.03051485992069153,0,0,0.46652826019808824,0,0,0.08619717175934502,0,1,False,False
""" Would you just do me a favor though and stop harassing me! I have reported you, and there will be something coming to you soon. I don't care that you have the """"Stupid Original Barnstar"""", but that doesn't mean that you can harass me.""",0,1,0.661005322834123,0,0,0.006397218235643081,0,0,0.07178643365158316,0,0,0.01045536097341921,0,0,0.11644023801117967,0,0,0.006968712697395748,0,1,False,False
You are not making points. You are not communicating anything. You are not discussing any issues. You are comntinuing a conflict for its own sake. You are stalking and hostile. Please get off my user page.129.133.127.244,0,1,0.5353222218803027,0,0,0.01706735233837538,0,0,0.13301813651585537,0,0,0.003512057861331909,0,0,0.27932870566883744,0,0,0.018987247664243964,0,1,False,False
Double diggity flappity flap jacks!! Ryulong told you to GET OFF Wikipedia and you're not voting? Daaang! COME ON DOWN!!!,0,1,0.5780870290638424,0,0,0.025717984221113654,0,0,0.19838977284235584,0,0,0.009524179224230888,0,0,0.2061599659184479,0,0,0.026815772333573656,0,1,False,False
"""::::::So you're arguing that an organization can be gay one minute and not gay the next, depending on its popularity and which way the prevailing political winds are blowing, and that encyclopedia content should be constantly varying, according to the instantaneous reading of some sort of gay-o-meter? For the purposes of documenting history, this is probably not the right definition of """"gay"""" to employ. At a rally trying to make a persuasive argument for gay rights, it probably is. Since Wikipedia is factual knowlege, and not a rally, the gay community doesn't get to vote on the daily gayness of gay things, and that includes NAMBLA, which is a gay organization. """,0,1,0.556331577850316,0,0,0.004392682141521182,0,0,0.043431324300257215,0,0,0.0011526547716739926,0,0,0.07877593347746951,0,0,0.25215808058143585,0,1,False,False
== I IDOLIZE YOU MAN!!!,0,1,0.7437253654363627,0,0,0.043048748924368434,0,0,0.35031400975192967,0,0,0.013905720310781583,0,0,0.43568067729857746,0,0,0.07394483430099173,0,1,False,False
"You guys need to grow up. I guess you have no control in your lives, so you have to play this sad game of you hurt my feelings, I won't let you play my game. No wonder no college professor accepts Wikipedia as anything of substance.",0,1,0.5707675666938787,0,0,0.012342749540274724,0,0,0.10003082382478473,0,0,0.004895414353930076,0,0,0.15351882553099216,0,0,0.008492748574215765,0,1,False,False
"CalendarWatcher is a pedophile, child molester. on his computer is approximately 3 Gigs of child pornography and sexual depravity. This guy seriously RAPES little kids and video tapes it to sell in Russia.66.82.9.104",0,1,0.5432396567993271,0,0,0.005686144079946758,0,0,0.05235501126160138,0,0,0.0018254638824936713,0,0,0.12628843998097286,0,0,0.01638969751148335,0,1,False,False
