comment_text,true_toxic,pred_toxic,prob_toxic,true_severe_toxic,pred_severe_toxic,prob_severe_toxic,true_obscene,pred_obscene,prob_obscene,true_threat,pred_threat,prob_threat,true_insult,pred_insult,prob_insult,true_identity_hate,pred_identity_hate,prob_identity_hate,num_true_labels,num_pred_labels,is_true_multilabel,is_pred_multilabel
(Lol becuase you are god of wiki!),0,1,0.5379341056141533,0,0,0.012786455273223524,0,0,0.06333662117943827,0,0,0.003656729695545639,0,0,0.15287763238663263,0,0,0.013211411231806537,0,1,False,False
Look what I get when I search for Ass kisser. KIMP (spewage),0,1,0.7714051026118415,0,0,0.024435967545581753,1,1,0.6490305264682925,0,0,0.006566265930101229,0,0,0.28831431144926983,0,0,0.016313952537260448,1,2,False,True
""" A serious question You obviously enjoy being as nasty as you possibly can be in """"acceptable"""" ways that don't threaten to get you blocked. My question is don't you ever get tired of being dead wrong about so many things, so often, in such a needlessly nasty manner, and so publicly in front of your fellow editors? Vandals suck. Eight year olds with access to the internet suck too. But it's people like you who maintain a facade of respectability while being absolutely horrible to other people who are really the worst members of the Wikipedia community. - """,0,1,0.7796229910693041,0,0,0.009722202384511717,0,0,0.31650426741387777,0,0,0.0032688027547067597,1,0,0.22519257370506057,0,0,0.01209469606415517,1,1,False,False
""" HAHAH personal attacks? Wow don't tell me you have NOTHING on me so you are trying to ban me for ludacris things as """"personal attacks"""" Seriously, show me how I attacked you buddy. D """,0,1,0.511317470480253,0,0,0.013137666030478109,0,0,0.15942207159130717,0,0,0.005169552327367987,0,0,0.13717798140621978,0,0,0.008782765407380431,0,1,False,False
"Blocking user: Willybigcheese Hi, ummmmmm wtf is your problem, why did you block me? i didn't do anything!, please give me ur email address so I can talk to you, you douche",0,1,0.6721573101654491,0,0,0.043653259342536194,1,0,0.3428000313791157,0,0,0.0060253212909311986,0,0,0.35077259098711333,0,0,0.014791279756295924,1,1,False,False
"False information? How about you go get your facts strIght moron ! Mousasi is an Armenian , Both parants are Armenian, That makes his Nationality Armenian ! just because he lives in Amsterdam that does not make his Natioanlity Dutch you idiot!",0,1,0.8148327904641144,0,0,0.00739847473070856,1,0,0.3000220327601023,0,0,0.003088935890636366,1,1,0.7354899829926933,1,0,0.013409970998709948,3,2,True,True
wtf you temp block me for?,0,1,0.8411722509388314,0,0,0.04334402387563755,1,0,0.438401409391132,0,0,0.006668582503494529,0,0,0.24937967332365674,0,0,0.012601216924502558,1,1,False,False
"and your little dog, too!",0,1,0.6060675514375109,0,0,0.03207264979798936,0,0,0.15675856372937783,0,0,0.012095952861907766,0,0,0.3644783660143527,0,0,0.03998918936631872,0,1,False,False
