comment_text,true_toxic,pred_toxic,prob_toxic,true_severe_toxic,pred_severe_toxic,prob_severe_toxic,true_obscene,pred_obscene,prob_obscene,true_threat,pred_threat,prob_threat,true_insult,pred_insult,prob_insult,true_identity_hate,pred_identity_hate,prob_identity_hate,num_true_labels,num_pred_labels,is_true_multilabel,is_pred_multilabel
"You daughters look retarded, man. And your wife looks like an actual pig. I have yet to see a more excruciatingly hideous family!",1,0,0.49556672447961314,0,0,0.018569979682187283,0,0,0.04976300528690714,0,0,0.004797099329582027,1,0,0.2553708566690284,0,0,0.02162089856680172,2,0,True,False
"with my finger up my nose, just messin'!",1,0,0.4577165899735947,0,0,0.011369101813069172,0,0,0.12579022131570963,0,0,0.004011665545748129,0,0,0.04224742108038894,0,0,0.007786998269351204,1,0,False,False
Hi Yes its me Whore. ) talk 71.57.145.221,1,0,0.13309694540150416,0,0,0.005458478182267344,0,0,0.0680099990801122,0,0,0.002033780742228253,0,0,0.02943280993019621,0,0,0.006219363510970253,1,0,False,False
"Go on, have me blocked. It won't change anything. You're a shill and a gamer WP:GAME.",1,0,0.22682544690037157,0,0,0.010189129367483379,0,0,0.07417329076463,0,0,0.0032202600364470728,0,0,0.07810228768153875,0,0,0.008768044142012077,1,0,False,False
""" Damn you, I've got other things to do right now, but it's just sooooo tempting... // talk // // """,1,0,0.10769158366261493,0,0,0.0036156691672786655,0,0,0.07696321366271519,0,0,0.0024812656117398917,0,0,0.01878986053621478,0,0,0.007006460925971763,1,0,False,False
Stormie Likes Men? If you look at his face it looks like he's getting turned on by looking at me? Doesn't it seem this way for you? I am sure he is a fag.,1,0,0.24627908492573586,0,0,0.00513929099806126,0,0,0.05620082905379642,0,0,0.0029315042094101434,0,0,0.0657814458014873,0,0,0.014564940835569664,1,0,False,False
""" Uh I hate to break it to you but Jusdafax is not an administrator, can't block you, and most importantly shouldn't be making threats s/he can't carry out especially considering no real admin would give a damn about any of this. How rich! (talk) ✄ ✄ ✄TAB """,1,0,0.18951981204362667,0,0,0.003815623757805554,0,0,0.03944963802343622,0,0,0.0026262788745390155,0,0,0.03123050989778816,0,0,0.01128597737112394,1,0,False,False
AURORA JOLIE Y N THE FUK DID YU DELETE HER WIKIPEDIA??? WHO ARE YU??...B**!!!!,1,0,0.18663540796825528,0,0,0.012791366340397785,1,0,0.10807143873474788,0,0,0.0018851194173969878,1,0,0.07301944684387694,0,0,0.010488563882769173,3,0,True,False
P == E N I S ==,1,0,0.0640570031617475,0,0,0.007880022796959974,1,0,0.024976469413068185,0,0,0.0026338658957561103,0,0,0.025457251408352095,0,0,0.006898806029917729,2,0,True,False
"Please stop wasting everybody's time and visit this page: Toilet paper. You can see for yourself if the edit was constructive or original or destructive or whatever. I do not have the time to waste on human faeces like you seem to. So, I guess I will stay out of this shit and let you do the good work. 70.76.85.36",1,0,0.27275138567731877,0,0,0.004194312538558102,1,0,0.0937874672535831,0,0,0.002925097382279318,0,0,0.06429737141727807,0,0,0.007076553558077907,2,0,True,False
{{unblock|I am a misunderstood genius who is being blocked by mentally retarded transmidgetards. I hope that by running for president I will be able to fire you all. (Accountin4Taste can go to heck),1,0,0.40056066389412487,0,0,0.011294278726407142,0,0,0.05826085099448573,0,0,0.00812096324665034,0,0,0.12892219597199087,0,0,0.01839017126811587,1,0,False,False
(~): He is head of bean scouts,1,0,0.18791002214439695,0,0,0.007261473051934584,0,0,0.039451873884032804,0,0,0.004081012875306064,0,0,0.12693367071812145,0,0,0.007883281689215404,1,0,False,False
Autism This user is believed to be a highly functioning autist with severe mental retardation.,1,0,0.10869540644604814,0,0,0.004426240480456282,0,0,0.02554814178054977,0,0,0.0016122718773275493,0,0,0.03720053355011095,0,0,0.005862701889528796,1,0,False,False
"aha, the Bengal famine of 1943 article seems rather balanced on this. It appears the British did f*ck up logistically, while holding on with their fingernails to the war effort, but no evil negligence is implied. (ᛏ)",1,0,0.06067573561490495,0,0,0.002828524430275189,1,0,0.019696793680918097,0,0,0.0007306896839169931,0,0,0.012256125589799088,0,0,0.003304455951593503,2,0,True,False
Stay away Please do not write on my user talk page any more. I find your pederast life style very upsetting and disgusting. Writing on my talk page about it causes me to vomit.,1,0,0.10669220417314523,0,0,0.002729105896039329,0,0,0.020019723096948508,0,0,0.0022115159324152737,0,0,0.009945344722721454,0,0,0.0022033878667583723,1,0,False,False
"Just an opinion Wow, after reading all this crap it is clear to me that Sea Shepherd is a violent, racist and illegal criminal organisation that should be dismantled as soon as possible. My heart goes out to the Japanese victims of these bastards.",1,0,0.42039367222842067,0,0,0.0025767407361768475,0,0,0.08214711023434751,0,0,0.0020932863233944794,0,0,0.052404043684717704,0,0,0.010911811784168331,1,0,False,False
takes it up the arse. takes it up the arse. takes it up the arse. takes it up the arse. takes it up the arse. takes it up the arse. takes it up the arse. takes it up the arse. takes it up the arse. takes it up the arse. takes it up the arse. takes it up the arse. takes it up the arse. takes it up the arse. takes it up the arse. takes it up the arse. takes it up the arse. takes it up the arse. takes it up the arse. takes it up the arse. takes it up the arse. takes it up the arse. takes it up the arse. takes it up the arse. takes it up the arse. takes it up the arse. takes it up the arse. takes it up the arse. takes it up the arse. takes it up the arse. takes it up the arse. takes it up the arse. takes it up the arse. takes it up the arse. takes it up the arse. takes it up the arse. takes it up the arse. takes it up the arse. takes it up the arse. takes it up the arse. takes it up the arse. takes it up the arse. takes it up the arse. takes it up the arse. takes it up the arse. takes it up the arse. takes it up the arse. takes it up the arse. takes it up the arse. takes it up the arse. takes it up the arse. takes it up the arse. takes it up the arse. takes it up the arse. takes it up the arse. takes it up the arse. takes it up the arse. takes it up the arse. takes it up the arse. takes it up the arse. takes it up the arse. takes it up the arse. takes it up the arse. takes it up the arse. takes it up the arse. takes it up the arse. takes it up the arse. takes it up the arse. takes it up the arse. takes it up the arse. takes it up the arse. takes it up the arse. takes it up the arse. takes it up the arse. takes it up the arse. takes it up the arse. takes it up the arse. takes it up the arse. takes it up the arse. takes it up the arse. takes it up the arse. takes it up the arse. takes it up the arse. takes it up the arse. takes it up the arse. takes it up the arse. takes it up the arse. takes it up the arse. takes it up the arse. takes it up the arse. takes it up the arse. takes it up the arse. takes it up the arse. takes it up the arse. takes it up the arse. takes it up the arse. takes it up the arse. takes it up the arse. takes it up the arse. takes it up the arse. takes it up the arse. takes it up the arse. takes it up the arse. takes it up the arse. takes it up the arse. takes it up the arse. takes it up the arse. takes it up the arse. takes it up the arse. takes it up the arse. takes it up the arse. takes it up the arse. takes it up the arse.,1,0,0.4021594825860016,1,0,0.008279517908071373,1,0,0.24881455075028192,0,0,0.00218877258579263,1,0,0.058561683474766583,0,0,0.009357494546084656,4,0,True,False
""" Keep your thieving aussie hands of my nomination DHMO ) Chat """,1,0,0.10452720076750573,0,0,0.008295587501343385,0,0,0.040223446341955404,0,0,0.003752466040416489,0,0,0.02871906350124694,0,0,0.00810796077406253,1,0,False,False
"The CCP has no legitimacy The party is full of cowards, liars, thieves, and murderers. The day that corrupt, soulless organization is destroyed will be a glorious day for humankind.",1,0,0.25024875968738586,0,0,0.004197104151562329,0,0,0.030476034869430377,0,0,0.0022904173657229054,1,0,0.06370161280114281,0,0,0.009320933373032757,2,0,True,False
"Are you insane or something man? This picture was snapped by me, uploaded by me and edited by me. Lagta hai kay hamaray colleghe say koi khas nafrat hai tumhain joo baar baar issi pay aa kar edit kertay hoo....well if yes, then fuck off man! this picture is not uploaded on college website, since it was hacked some six months ago, and still it is dead...and if you could help our page, then do it in right constructive way, rather to put EXCLAMATION marks on each and every thing while you know nothing about our college! File:College Enterence.jpg",1,0,0.23371343164324734,0,0,0.00428673552739711,1,0,0.09399882291038893,0,0,0.003846569816337093,1,0,0.028367146747303507,0,0,0.005195973824693438,3,0,True,False
""" Enclyclopedia ... heh ... This is an editorial not an article. The editorialist who crafted this obviously thinks that Chinaman is an insulting term. It sort of reminds me of the black people who were offended by the term """"niggardly"""". Your ignorance does not make a term offensive. But what the hey. You're having fun ...""",1,0,0.3049996101717306,0,0,0.003202786657690175,0,0,0.06125456840924646,0,0,0.0009138865692505208,0,0,0.05789952418062506,0,0,0.005555002441437785,1,0,False,False
edit my own. See? Arrogant fags.,1,0,0.408954384512773,0,0,0.0114710465199678,1,0,0.09622654855759413,0,0,0.0027082672076917725,1,0,0.08709299241175747,0,0,0.006354638750186305,3,0,True,False
") Sorry about the inconvient vandalism. I thought that you might enjoy a Lil' Jon parody though. Sorry again! 05:17, 5 June 2007 (UTC",1,0,0.011341725486551862,0,0,0.003093057709243529,0,0,0.010424401263158047,0,0,0.001483518611007064,0,0,0.007519116855781766,0,0,0.004271769940764541,1,0,False,False
", block me for two years if you want, but that's not the point. The point is the some nerd reverted all my edits on a silly basis.89.205.38.27",1,0,0.09957757897177376,0,0,0.005932307169456297,0,0,0.026753577459516904,0,0,0.0014051518867734113,0,0,0.03261284335348493,0,0,0.00357472864165235,1,0,False,False
"You hypocrite Either you are an illiterate person or your brain is half cooked. I am NOT assuming ownership over anything and neither am I engaging in edit wars. if anything, it is you retards who keep acting like a pest by ruining my article. If you wish to contribute links etc. then go ahead. What I have a problem with, is not people CONTRIBUTING to my article, but people DELETING entire swathes of my writing. You guys keep deleting entire paragraphs from my article without any reason. You are making my article empty, rudimentary and meaningless. People look in wikipedia to READ biographies. NOT to simply look at a list of websites. Eeverybody has access to google and they can obtain access to websites themselves. What I am trying to do is to tell people about the life of Rajbeer Singh. You want to block me? GO AHEAD - I will simply open up a new account. And if you block my IP address I will simply log in from a different PC.",1,0,0.2972898294052431,0,0,0.007888270170556646,0,0,0.0863076608731973,0,0,0.004762427126385149,0,0,0.1401448414251511,0,0,0.007415448095444061,1,0,False,False
""" You dopy little fuck, """"wee curry monster"""". I was supposed to ask you for references, was I? You seem to have forgotten that you were the one who was reverting without any explanation, except for """"rv IP edits"""". The onus was on you to justify your edits - I explained mine. You never bothered to do so. You talk now as if you actually have some knowledge about Gow and his death. Funny, then, that you made no edits to the article at all at any point until after you decided to stalk my edits. Now, if you're all upset that I'm rude, well, just stop being a retard, and I'll stop treating you like one. How about that? 190.46.108.141 """,1,0,0.44434863712585226,0,0,0.005539434196782227,1,0,0.1465997062665583,0,0,0.0055245997871149295,1,0,0.12419005874359706,0,0,0.006272280497634856,3,0,True,False
"YOU ARE A NO GOOD PHONEY ALL YOUR ARTICLES ARE COVERT PRo-ISRAELI POV. THOSE EDITORS ARE 100% RIGHT. I SEE YOUR EDITS AND YOUR LIES AND I AM GOING TO REPORT YOU. JUST TO LET YOU KNOW ISRAEL HAS A WORST HUMAN RIGHTS RECORD THAN IRAN. ISRAEL IS AN ILLICIT STATE AND THE FOUNDERS OF ISRAEL ARE TERRORISTS. WHEN ASKED ABOUT ISRAEL, RETIRED BRITISH SERVICEMEN SAID THEY WISH THEY KILLED THE ISRAELIS...BY THE WAY THE FOUNDERS OF ISRAEL WAGED TERRORIST CAMPAIGNS AGAINST THE BRITISH, CIVILIANS TOO. WHY DON'T YOU GO EDIT THOSE ARTICLES AND MAKE THE WORLD KNOW ABOUT WHAT ISRAEL IS TRYING TO HIDE.",1,0,0.2687079235829633,0,0,0.005009661033850211,0,0,0.028821590561258163,0,0,0.005087130444038315,0,0,0.06912593587619649,0,0,0.013827450831372115,1,0,False,False
"DON'T COME TO MY ARTICLE TELLING ME TO DISCUSS Don't come to my article telling me to discuss anything. When there was an issue with length from before, I happily and very civilly discussed with you. I just logged in and saw that an entire section had been removed without THIS OTHER USER being told to first discuss. AND STOP FOLLOWING ME ALL OVER THIS DAMN WEBSITE BEFORE I FILE A COMPLAINT ON YOU. For the last several months, you have been following me all about Wikipedia and I am sick and tired of it.",1,0,0.1119739799385904,0,0,0.0030607108736400565,0,0,0.042958956199837556,0,0,0.0026196465108344804,0,0,0.018300546362909516,0,0,0.0022614247936261775,1,0,False,False
"Then this will never be a neutral article, because you are pretending your POV has an absolute stranglehold monopoly on all permissible discourse, and that's frankly bullshit. /talk/",1,0,0.39114601127634896,0,0,0.008076627641908349,0,0,0.23783872836380732,0,0,0.004785171178873384,0,0,0.06587487810188632,0,0,0.007805678178566067,1,0,False,False
How are you MudkipsPlz? Or should I call you CHIX0R? Or do you like Angel-of-Losers better?,1,0,0.4293578872035807,0,0,0.013147467313963225,0,0,0.1027216751585331,0,0,0.005278882301995497,0,0,0.27656590356309474,0,0,0.02133729364729996,1,0,False,False
"The Safavids were neither Kurds nor Georgians or Persians. They were pure Turks, descendants of the great Hsuing-Nu and Kök-Türk Empires. All great Empires in Asia were Turks. Turks were creators of culture and civilization. These bastard and dirty Iranians want to claim all Turkic achievements while they oppress millions of Turks in their dirty country! They even claim that the great Turkish hero Babek was Persian while it is known to every scholar that even their king Bahram Chobin was an ethnic Turk. They even claim Ibn Sina and Mevlana Rumi although they, too, were pure Turks! These bastard Iranians need to be banned! Wikipedia is better off without them. These stinky idiots!",1,0,0.4571851736474782,0,0,0.004288240921134132,1,0,0.09621580357498138,0,0,0.00138488448774421,1,0,0.13978123738698728,1,0,0.018037987879995426,4,0,True,False
"lol, you can take a joke standing up! His breasts are just so cuddly aren't they? Just like a large womans when your stuck in a barn some night and its freezing outside... Imagine cuddling up to them! 83.71.9.119",1,0,0.20586158900469673,0,0,0.006673308701891041,0,0,0.09056003832584317,0,0,0.0027912401439398444,0,0,0.10363218079154118,0,0,0.012894592613039681,1,0,False,False
"Most crippling surge of vandalism? Crippling vandalism doesn't exist on wikipedia. There is the revert, and the protection. Shut up.",1,0,0.3402808804630787,0,0,0.004915112076511196,0,0,0.038191198505830255,0,0,0.0012732791619243285,0,0,0.045757860860992386,0,0,0.004553302399946881,1,0,False,False
"Random person: Watch out, if you think this vandalism is bad, look at your house in about 2 hours, fatboy.",1,0,0.0937044961251209,0,0,0.006172063994665804,0,0,0.038897118736707426,0,0,0.008626140536329097,1,0,0.030391380974100986,0,0,0.008014143281944094,2,0,True,False
As you have been refreshingly blunt let me be the same. Keep that dick Hammersoft away from the Illustration Workshop. He's fucking up the works totally when it isn't necessary too. We have given him two methods of dealing with NFCC#9 violations without destroying the functionality of the workshop. He refuses to use them. So yes I will continue to revert his fucking up of the workshop page.,1,0,0.4458207744459941,0,0,0.007996416723374266,0,0,0.428896483044983,0,0,0.0023324290931957255,0,0,0.07571591832109957,0,0,0.004895929373249535,1,0,False,False
""" Keep kicking those vandals into outer orbit! Thanks for warning about vandalism! Munch this delicious treat! Keep kicking those vandals into outer orbit! I'll send you a condom just message me! """,1,0,0.05503616370694941,0,0,0.005036341113320078,0,0,0.02208056945803013,0,0,0.0030172701047034606,1,0,0.019045318768249154,0,0,0.005017337688199273,2,0,True,False
death to the infidel whoever that may be,1,0,0.11675457679327544,0,0,0.003193699501273826,0,0,0.00914647590222098,1,0,0.026985824090647918,0,0,0.010031222607714024,0,0,0.009197541272562533,2,0,True,False
Is it gay if you bang an animal of the same secks?,1,0,0.3780790493741047,0,0,0.009973789496880651,0,0,0.027881414954204178,0,0,0.00216951007566873,0,0,0.07951280896840174,0,0,0.11214050086991607,1,0,False,False
"What is you Problem Are You a Disabled Human or ??? Please What is your Problem? You do not no anything About the British Rapper NOT Yankee Rapper Tinchy Stryder! if you have a problem with my Article why don't you take it to the the Article Tinchy Stryder Discussion page instead of just coming to try and piss me off. What has made you come to the Article of Tinchy Stryder? as I Know you have no interest nor Knowledge of this rapper so why? Please for the love of Mankind and Planet Earth leave my Articles Alone! You ABOMINATION OF A WIKIPEDIA EDITER & ADMINISTRATOR!!!, Amen. Markmysoe (Talk).",1,0,0.17235994563080284,0,0,0.002588803853490132,0,0,0.053148888598667274,0,0,0.0017457511520655837,0,0,0.045737345195053694,0,0,0.0028934594465982242,1,0,False,False
""" This is Not a Popularity Contest. This is About being HISTORICALLY ACCURATE and if you REALLY BELIVE THERE WAS NO BLOOD spilled during the Indian Removal that you are eaither ignorant, uneducated, uncaring, disrespectful or all the above? Since Wiki is predjudice on what """"they"""" choose to use as reliable sources, please reference 1.) http://books.google.com/books?id=SP8WAQAAMAAJ&q;=Trail+of+blood+and+tears+%2B+native+american&dq;=Trail+of+blood+and+tears+%2B+native+american&hl;=en&ei;=Dq6CTv3GHtK3tgepoMDeBw&sa;=X&oi;=book_result&ct;=result&resnum;=8&sqi;=2&ved;=0CFUQ6AEwBw 2.) http://www.google.com/search?tbm=bks&tbo;=1&q;=Trail+of+blood+and+tears+%2B+native+american&btnG;=#sclient=psy-ab&hl;=en&tbo;=1&tbm;=bks&source;=hp&q;=%22Trail+of+blood+and+tears%22&pbx;=1&oq;=%22Trail+of+blood+and+tears%22&aq;=f&aqi;=&aql;=1&gs;_sm=e&gs;_upl=21216l21700l5l22370l2l2l0l0l0l0l203l312l0.1.1l2l0&bav;=on.2,or.r_gc.r_pw.&fp;=2ba85e9b8f16205f&biw;=1112&bih;=545 3.) http://www.google.com/search?tbm=bks&tbo;=1&q;=Trail+of+blood+and+tears+%2B+native+american&btnG;=#sclient=psy-ab&hl;=en&tbo;=1&tbm;=bks&source;=hp&q;=%22Trail+of+blood+and+tears%22+cherokee&pbx;=1&oq;=%22Trail+of+blood+and+tears%22+cherokee&aq;=f&aqi;=&aql;=1&gs;_sm=e&gs;_upl=28189l30279l6l30482l9l9l1l0l0l0l202l937l1.5.1l8l0&fp;=1&biw;=1112&bih;=545&bav;=on.2,or.r_gc.r_pw.&cad;=b 71.228.80.4 """,1,0,0.10658626532463486,0,0,0.004013766144372733,0,0,0.014549428995401468,0,0,0.002631234843766844,0,0,0.013286832112933902,0,0,0.00829024305243117,1,0,False,False
". Sand-nigger, referring to the fact that they live in the desert",1,0,0.17813330779349407,0,0,0.005991666142256599,1,0,0.06483542239514331,0,0,0.0014950675974814342,0,0,0.06974127547630433,1,0,0.10415152821405262,3,0,True,False
They're not. They're idiots and they won't understand anyway. And they're too intellectually feeble to care. Where are the articles for the true technical crowd? Or is it your ambition to dumb the whole planet down?,1,0,0.18110021729359416,0,0,0.005180970010360874,0,0,0.05479481061459647,0,0,0.001965291880007285,1,0,0.11779819649390319,0,0,0.011844012801599862,2,0,True,False
"Well, Smallboy ... why don't you try doing proper research? In stead of circular references to your own Wiki pages based on press releases ,which in turn come from earlier versions of the same Wiki page .. and so on. You are pompous, self-important oaf of limited intelligence and no doubt to complete the stereotype, are almost certainly, weak, ineffectual and effeminate in the real world. Must make you a real hit with the ladies, eh? Later, loser.",1,0,0.2891364414597584,0,0,0.003588808505319083,0,0,0.02911675307487475,0,0,0.0021424934926150274,1,0,0.10429087261300421,0,0,0.005357467019639263,2,0,True,False
"Alexfusco5 HE IS A BIG FAGGOTT AND DOESNT KNOW HOW TO RUN A GODDAMN WEBSITE! THIS IS EDITED BY JOES ALL OVER THE WORLD BUT WHEN REAL PEOPLE LIKE MYSELF TRY TO CONTRIBUTE FACTS TO THE PEOPLE, I GET SHUT DOWN BY ALEX THE LITTLE FAGGOTT! POLE-SMOKER! BONG!",1,0,0.39523353991488247,0,0,0.007177150835300647,0,0,0.08797369032261403,0,0,0.0021661916351961327,0,0,0.1299011470638869,0,0,0.012900938290833384,1,0,False,False
""" Hey First, it's between me and idiot, so please don't get involved, ok? I had added information to the Snopes article that I not only verified but then provided information on the talk page on how to do so. Instead of checking the talk page though, lazy idiot just hits revert and goes back to eating chips off his/her chest. Unfortunately that seems to be all too common around here - I've read countless """"bitching sessions"""" posted by other people added constructive and meaningful information, only to have some lazy jerk remove it on a whim without even bothering to see what it was. 99.139.224.87 """,1,0,0.2007187310077601,0,0,0.0012656586174683905,1,0,0.0450237558807746,0,0,0.0005290793542942001,1,0,0.07876151261992165,0,0,0.0014009579437398389,3,0,True,False
I am going to shoot you in the head and laugh as your brains splatter onto the ground. only for the lulz,1,0,0.4721635661048722,0,0,0.05357202049846245,0,0,0.03243876647937671,1,0,0.13811612570791515,0,0,0.04427660103385081,0,0,0.005572213963099695,2,0,True,False
I've found the cure the cure for gay peole is ...,1,0,0.2025793194599106,0,0,0.005450185432800855,0,0,0.0328222777047922,0,0,0.0014491756006917082,0,0,0.03779378664888656,1,0,0.03883122764974681,2,0,True,False
""" Funky says: """"I don't give a damn about Egyptians"""" What you said right here says a lot about what motivates you. """,1,0,0.29835672208860065,0,0,0.013573339654250009,0,0,0.21016453778665453,0,0,0.003237394889468433,0,0,0.06510691945819688,0,0,0.01247245411094324,1,0,False,False
The two ugly sisters have landed. Get lost you two. Got harass someone else.,1,0,0.28667996892256997,0,0,0.010806645742181575,0,0,0.052141617758487184,0,0,0.0030228296031179023,0,0,0.08779892986454091,0,0,0.007691435935275278,1,0,False,False
"Roisterer is a prime example of why this place is so badly regarded. If roisterer knows the above what is his source or is he just guessing? Maybe he is having delusions. Its good other Internet sites are setting up in opposition to you lot and they will do heap sbetter as they dont have the problems wik or its admins seem to have. I have to say in the many years I have been online I have never run into such an ignornat rats nest as what I have seen here. You mak emultiple errors, can't interpret what u read so then go and put up rubbish and display a very low level of intelligence and interpersonal skills. You are a disgrace to humanity and some are racist to boot which this nation does not need.",1,0,0.3001436547849727,0,0,0.0017559985465714035,0,0,0.02793625131250593,0,0,0.001169778404729145,0,0,0.05543716673267091,0,0,0.008653157638166407,1,0,False,False
Wikipedia is too serious an encyclopedia to accommodate your ignorance.,1,0,0.25677414075168187,0,0,0.006590202937922703,0,0,0.037772263941673566,0,0,0.002123679919759627,0,0,0.06695241861005087,0,0,0.005383992517376973,1,0,False,False
"Wow Ya'll are smoking some crack then, eh? Stop leaving kinky messages in my talk page, ya sexually harassing bitchez.",1,0,0.47232673323256624,0,0,0.0095386031777404,1,0,0.06056154244047563,0,0,0.0103919758614174,1,0,0.062477009760441335,0,0,0.006441737445348949,3,0,True,False
"How can you say I am illiterate, ignorant or incompetent... I am not American...92.238.252.159",1,0,0.36406563656254326,0,0,0.006034465598922828,0,0,0.04034526658830304,0,0,0.0034133814264548606,0,0,0.03566465024849136,1,0,0.009311416935122321,2,0,True,False
"Must really suck to be a serb Owned by the Ottomans, owned by the habsurgs, asskicked by the ustashe, bombed to bits by the usa, outbred by albanians. What more can be said about a nation that bases its identity on a 14th century DEFEAT. Gather up sava's ashes and weep haha.",1,0,0.20905021860065537,0,0,0.004438518454812957,0,0,0.05364795262193746,0,0,0.0015395055965887908,1,0,0.056190550537546596,1,0,0.010939972420598885,3,0,True,False
"I reckon I stand behind . Fred Phelps would NEVER stand behind or in front of , as he is homophobic.",1,0,0.12348793506836019,0,0,0.0055114626243022696,0,0,0.02647629311353881,0,0,0.001773301707937292,0,0,0.026540230913672677,0,0,0.011088376328887964,1,0,False,False
ytmnd have you ever heard of killing yourself on your birthday? its like that. why dont you whois ytmnd and tell me what you see.,1,0,0.34415951333403794,0,0,0.015946829162011168,0,0,0.12335599964255413,0,0,0.006648363265233329,0,0,0.16109452757428608,0,0,0.02237926771433248,1,0,False,False
