comment_text,true_toxic,pred_toxic,prob_toxic,true_severe_toxic,pred_severe_toxic,prob_severe_toxic,true_obscene,pred_obscene,prob_obscene,true_threat,pred_threat,prob_threat,true_insult,pred_insult,prob_insult,true_identity_hate,pred_identity_hate,prob_identity_hate,num_true_labels,num_pred_labels,is_true_multilabel,is_pred_multilabel
What a bloody damn joke. We have half a dozen censors ready to spend many hours until whats left of the article is all of 4 sentences long and relates ZERO about an ogoing public fraud. The SINGULAR contributor has been chased away and AFTER said half dozen censors have done their badge-hunting work what is left? And a body can't say squat about the fully licensed Kleargear lawyer scamming people every freakin day? Thats Wikipedia censorship and to join this club is to lose all ethics completely. Take a bow boyos. I keep asking the question and NOBODY will answer it. WHO thinks Kleargear is NOT a fraud? If a body is accepting the obvious then WHY are censors bending over backward to censor every word?,1,0,0.21129531728532067,0,0,0.002909847165247964,0,0,0.045189346349462034,0,0,0.0013969023043410675,0,0,0.036329135755836836,0,0,0.004892166585626326,1,0,False,False
""" """"Unsolicited"""" sounds as if Sukecchi came to your son and told him he was gay. In fact, the relevant userbox sat in his userspace along with such uncontroversial personal information as his being male and what state he lives in. It's common on this site that editors declare facets of their individuality to build a sense of community that creates another incentive for us to be here and work on articles, just as workers everywhere chat around the water cooler and companies tolerate some slacking off as long as the work gets done. We have different standards on a volunteer site, but indicating someone declaring his sexual orientation will make others """"feel turned on"""" is creation of unnecessary drama. - t """,1,0,0.05782119243407377,0,0,0.001788608438000375,0,0,0.017262487066123253,0,0,0.0012359855063277926,0,0,0.019882698057710507,0,0,0.006376049482537055,1,0,False,False
MILBURN IS A BARBARIAN PICTURE DELETOR ANIMAL! I WILL KICK OFF HIM from wiki,1,0,0.4140901540758355,0,0,0.01505835829949121,0,0,0.1479171212497657,0,0,0.011935391574042928,0,0,0.11125239335289938,0,0,0.012914726833712796,1,0,False,False
Mattythewhite is a bitchMattythewhite is a bitchMattythewhite is a bitchMattythewhite is a bitchMattythewhite is a bitchMattythewhite is a bitchMattythewhite is a bitchMattythewhite is a bitchMattythewhite is a bitchMattythewhite is a bitchMattythewhite is a bitchMattythewhite is a bitchMattythewhite is a bitchMattythewhite is a bitchMattythewhite is a bitchMattythewhite is a bitchMattythewhite is a bitchMattythewhite is a bitchMattythewhite is a bitchMattythewhite is a bitchMattythewhite is a bitchMattythewhite is a bitchMattythewhite is a bitchMattythewhite is a bitchMattythewhite is a bitchMattythewhite is a bitchMattythewhite is a bitchMattythewhite is a bitchMattythewhite is a bitchMattythewhite is a bitchMattythewhite is a bitchMattythewhite is a bitchMattythewhite is a bitchMattythewhite is a bitchMattythewhite is a bitchMattythewhite is a bitchMattythewhite is a bitchMattythewhite is a bitchMattythewhite is a bitchMattythewhite is a bitchMattythewhite is a bitchMattythewhite is a bitchMattythewhite is a bitchMattythewhite is a bitchMattythewhite is a bitchMattythewhite is a bitchMattythewhite is a bitchMattythewhite is a bitchMattythewhite is a bitchMattythewhite is a bitchMattythewhite is a bitchMattythewhite is a bitchMattythewhite is a bitchMattythewhite is a bitchMattythewhite is a bitchMattythewhite is a bitchMattythewhite is a bitchMattythewhite is a bitchMattythewhite is a bitchMattythewhite is a bitchMattythewhite is a bitchMattythewhite is a bitchMattythewhite is a bitchMattythewhite is a bitchMattythewhite is a bitchMattythewhite is a bitchMattythewhite is a bitchMattythewhite is a bitchMattythewhite is a bitchMattythewhite is a bitchMattythewhite is a bitchMattythewhite is a bitchMattythewhite is a bitchMattythewhite is a bitchMattythewhite is a bitchMattythewhite is a bitchMattythewhite is a bitchMattythewhite is a bitchMattythewhite is a bitchMattythewhite is a bitchMattythewhite is a bitchMattythewhite is a bitchMattythewhite is a bitchMattythewhite is a bitchMattythewhite is a bitchMattythewhite is a bitchMattythewhite is a bitchMattythewhite is a bitchMattythewhite is a bitchMattythewhite is a bitchMattythewhite is a bitchMattythewhite is a bitchMattythewhite is a bitchMattythewhite is a bitchMattythewhite is a bitchMattythewhite is a bitchMattythewhite is a bitchMattythewhite is a bitchMattythewhite is a bitchMattythewhite is a bitchMattythewhite is a bitchMattythewhite is a bitchMattythewhite is a bitchMattythewhite is a bitchMattythewhite is a bitchMattythewhite is a bitchMattythewhite is a bitchMattythewhite is a bitchMattythewhite is a bitchMattythewhite is a bitchMattythewhite is a bitchMattythewhite is a bitchMattythewhite is a bitchMattythewhite is a bitchMattythewhite is a bitchMattythewhite is a bitchMattythewhite is a bitchMattythewhite is a bitchMattythewhite is a bitchMattythewhite is a bitchMattythewhite is a bitchMattythewhite is a bitchMattythewhite is a bitchMattythewhite is a bitchMattythewhite is a bitchMattythewhite is a bitchMattythewhite is a bitchMattythewhite is a bitchMattythewhite is a bitchMattythewhite is a bitchMattythewhite is a bitchMattythewhite is a bitchMattythewhite is a bitchMattythewhite is a bitchMattythewhite is a bitchMattythewhite is a bitchMattythewhite is a bitchMattythewhite is a bitchMattythewhite is a bitchMattythewhite is a bitch,1,0,0.32100279854535224,1,0,0.0014523565269046847,1,0,0.06236191329226908,0,0,0.00039111502600234414,1,0,0.15390520109953978,0,0,0.015397909606824889,4,0,True,False
I'm trying to start an article on a fairly well-known independent band on the Toronto scene. This is perfectly valid wikipedia material so don't be a jackass and delete it.,1,0,0.09599548263548703,0,0,0.0016957226524294984,0,0,0.05753572088688419,0,0,0.0010773121604740672,0,0,0.031090518929492928,0,0,0.0029404890930505526,1,0,False,False
""" you're so immature and condescending, grow up! I won't reply or read your nonsense anymore but you're the one guilty of the 3 revert rule. mine was done to fix it, you went on another ip and changed it as did another editor. you can type what you want to make yourself look right but you're not. i'm going to go on all the articles I've found that list people the way it was on this article and remove it per your user name. gotta be consistent, right? i'm going on the [removed so you can't stalk me again] article and several others I found that have the same format and remove it all """"per hell in a bucket"""". thanks for the tip, bitch! lmao at you cus you're ignorant and petty! 74.62.92.20 """,1,0,0.3302082661890019,0,0,0.004786291723088304,0,0,0.11237472851528266,0,0,0.00351173171419232,0,0,0.13535274624270954,0,0,0.004866354061592611,1,0,False,False
""" """"This discussion is over""""... why is that? Because you don't like the way it's going? You criticize someone for providing references that meet the requirements of Wikipedia policies (even when other content in the article is referenced dubiously) and yet you waffle on about why you think he's wrong without any references yourself. Morons like you are why Wikipedia is losing it's credibility as an true and objective information resource.""",1,0,0.1458028430295282,0,0,0.0032290999306327276,0,0,0.032511647665294796,0,0,0.0016188503100725735,0,0,0.06107037688057453,0,0,0.00546376606453635,1,0,False,False
"oly crap! I looked up the links! THE EXPLANATIONS ARE THERE. IF YOU'RE TOO (BLANK) TO READ THEM, THEN TOUGH NOODLES. I CLEARLY STATED THAT THE EVENT (JAKE'S KIDNAPPING, ROB AND PAT'S FIRST WEDDING, AND THE BIRTHDAY) HAPPENED OVER 2 WEEKS. WHAT AN ID*OT.",1,0,0.16888397550205558,0,0,0.0035132262445900643,0,0,0.05891189751445299,0,0,0.0020547179929239347,1,0,0.028384523304835926,0,0,0.004353816296443352,2,0,True,False
""", 2 February 2006 (UTC) Perhaps if you would quit removing comments from the Talk Page of WWE Undisputed Championship because you disagree with them? You give false claims of """"vandalism,"""" yet there is none per Wikipedia definition. I only place the remarks back in that you delete. In point of fact, YOUR removal of the comments is vandalism as Wikipedia defines the definition. I do have a beef with you, yes. I admit it. I dislike you. You're a douchebag. But I am not """"attacking"""" you (as Curps has defined it) when I place the comments back in. I am merely taking care of business in regards to that talk page. Wikipedia user has told you about this, has even told you about this, but yet you continue to not listen to anyone. This is not even an isolated incident you have done this to rec.sport.pro-wrestling on at least five occassions. If you do not like me posting, or have a problem with what I place in, then either put it on the talk page of whatever account or IP I am using or stop whining and shut up. Your pathetic kindergarten-like tactics of running to Curps everytime I do something you don't like is just fucking sad. 20:28""",1,0,0.2891195567263777,0,0,0.0024216459620761354,0,0,0.05092134919857566,0,0,0.0015960077850751414,0,0,0.058283283322607904,0,0,0.002861049013083123,1,0,False,False
"Do you have a brain?!?!? That was in March!... March...April...May....June...July and for 31 hours, im not blocked anymore moron!",1,0,0.1911221116052465,0,0,0.004506443476192148,0,0,0.06559291016759891,0,0,0.002136687363722813,0,0,0.05663474018939582,0,0,0.0051311135972586745,1,0,False,False
"Harry the Dirty Dog - CONFLICT OF INTEREST Harry the Dirty Dog seems to be adamant that he knows the Hasnains and that they are out of the country or have been arrested. I think there is a bit conflict of interest. This news was taken out 1 year old traced back to the Mercury news. The name of Pakistan and a beauty pageant has made it interesting enough. So far and far, Harry the Dirty Dog this user is doing vandalism and it seems he is not allowing for us to remove the non-reliable sources and references. Also this user seems to have a personal agenda to secure this as far as possible, and seems to me, this user Harry the Dirty Dog is on a personal agenda of defaming this lady. There is no proof and this is a rumour according to me and is supposed to be dismissed. If any one needs to research then one must google up and find out what she is up to! Harry the Dirty Dog is on a personal agenda and seems to be one of the people trying to defame her. This news is one whole year old with no follow up! SUch are labelled as rumours only! Sonisona",1,0,0.0682174589229603,0,0,0.0012229004172548093,0,0,0.01479643934789481,0,0,0.0005813667507540065,0,0,0.028659856133520893,0,0,0.004288834839158973,1,0,False,False
""" This is of no consequence, I have listed my source, and you have listed yours (albeit you do not refer to when Obolensky calls them Slavs, or any source calling them slavs for that matter), you English are out for our History, and we know this only too well, you have ALWAYS tried to steal Greek History and destroy the Greek nation state as The French Consulate's History of the Greek Revolution shows. We will not tolerate it, the term """"Greek (I.e. 'Byzantine')"""" will remain on the front page, and there it shall stay. FYROMian claims are no more reliable than their claims """"Alexandor Makedonski"""" (they actually believe he called himself that! D) was a Slav. Oh, and by the way, Fuck the Queen and Fuck England.""",1,0,0.28402368180814547,0,0,0.003298806855852164,0,0,0.13109924905547388,0,0,0.0020769190423839843,0,0,0.03237014920457916,0,0,0.005747774566790155,1,0,False,False
n ig ger nig ger Hi n i g g e r,1,0,0.01451771450398857,1,0,0.0038050961031118394,1,0,0.01200516354320367,0,0,0.0018951049446685533,0,0,0.007410021392763948,1,0,0.005337484791385609,4,0,True,False
""" He's also, to be fair, managed to use other fora here to shout racist crap. """"[T]he GUI looks like it was designed by a handful of Congolese 3rd graders wearing grass skirts"""", really? smash! """,1,0,0.28241750162581797,0,0,0.0027065372007806835,1,0,0.044377767948763185,0,0,0.0014854174695425296,0,0,0.03242674520641619,0,0,0.009596151721540904,2,0,True,False
You support the president!? Do you like the smell of tax money down the drain and dead people being killed for a lost cause.,1,0,0.44507212968980775,0,0,0.012487045547245317,0,0,0.03128026652392122,0,0,0.006488709930761633,0,0,0.12482172838260325,0,0,0.016345694998648637,1,0,False,False
User:NHRHS2010 is a homo like mitt romney is. User:NHRHS2010 is a homo like mitt romney is.,1,0,0.4648487890911858,0,0,0.016991368724591987,0,0,0.07180405479334831,0,0,0.0020324647798340605,0,0,0.1203412390784321,0,0,0.042303293953930905,1,0,False,False
a virgin. Nighty night,1,0,0.07653930508264133,0,0,0.009852080747698912,0,0,0.05212967557096652,0,0,0.0024325459269023313,0,0,0.059182496836267605,0,0,0.013665429876068426,1,0,False,False
Hey Dictator how would you like to be on an online radio program up for a debate? Its through the phone. And I can try to cooperate and get a good time then schedule for you. Don't be chicken. Come on and debate me then. 71.105.87.54,1,0,0.17518355130114804,0,0,0.006966518513337963,0,0,0.07683871556300033,0,0,0.004632729639888525,0,0,0.07538215624260607,0,0,0.010566324127535958,1,0,False,False
"(UTC) Changlc and Jiang, always together?? Why are you two communist clowns so annoying??? 05:12, 20 May 2005",1,0,0.07385915246629211,0,0,0.005502806357135888,0,0,0.0345905372959444,0,0,0.002461132369200428,0,0,0.03839358067562558,0,0,0.016989697753818145,1,0,False,False
""" Don't accuse sockpuppetry without evidence! What kind of crap is that? Spoken like a true despot! Let's have the evidence or unblock. You can't convict without evidence, that's very disruptive! —Preceding unsigned comment added by 71.120.14.192 """,1,0,0.23506403157759242,0,0,0.0026736760607633217,1,0,0.03889152515979529,0,0,0.0010985878613662243,1,0,0.05015828237067638,0,0,0.0039058307679582854,3,0,True,False
"If there was a cure for AIDs, it would probably be bought up by rich jerks and sold for double. I believe that if u have AIDs, then that is sad for you, but many people have said that the ones to blame are ..... well, I wont go into that here. many people have there own opinion of who it is. But that is just my opinion. It must suck to be a person with Aids. I would not know.",1,0,0.16840693568901371,0,0,0.0016782062092231508,0,0,0.02314202833171898,0,0,0.0009279918032259038,0,0,0.031205270394404103,0,0,0.004189963536138175,1,0,False,False
""" What the hell does that mean? Talk English not Wiklish. Are you some kind of homomorph? -) As to RoyBoy, he is not very good at checking his facts. Even a cursory Google would show that Jonathan Sarfatti and Jack Sarfatti are not the same person and live on different continents. Notice how silent the Great Mathematician Dr. Hillman is in the light of Nobel Prize physicist Brian Josephson's remark above putting him in his proper place and in Hillman's inability to respond to Sarfatti's detailed argument above. It is not enough to bluster """"it's nonsense"""". Burinski will also respond he is not on e-mail all the time. None of your facts check out. Everything Sarfatti has said is the truth and his arguments on the physics have not been refuted. You people not only have no respect for truth, you simply cannot even perceive it because this information is too advanced for all of you - even Chris Hillman who is not a physicist although he is a mathematician of sorts - he admits he is not even interested in quantum theory so he should recuse himself if he were really honest. Brian Josephson wrote the reality above. SIGNED JackHorner from The Corner 11:42 Pacific Time Sept 25, 2005""",1,0,0.05400800041816381,0,0,0.0007950767066925646,0,0,0.01489705671401669,0,0,0.0007673314609302208,0,0,0.012855181785221501,0,0,0.003073245182390921,1,0,False,False
Typically greek Ridiculous and worthless!80.47.102.164,1,0,0.31813377631927336,0,0,0.006194712733241895,0,0,0.03541658184569911,0,0,0.002755848330321767,0,0,0.029938182379501396,0,0,0.005328095660186513,1,0,False,False
HELP I AM AT GUNPOINT AND IF I DONT STOP ADDING FICTIONAL HOMOSEXUAL CATEGORIES TO PAGES HE WILL KILL ME PLEASE UNBAN ME SO I CAN ADD THEM,1,0,0.3318313736856602,0,0,0.009605614199863347,0,0,0.05060438667689708,0,0,0.03412861805820654,0,0,0.03387987755819133,1,0,0.027949604160251086,2,0,True,False
"Oh yes, john let us all join the hate fest against turks. Remember Turks are evil and Turkiye should be nuked...Yesssssss",1,0,0.27772988196334975,0,0,0.006592531974062997,0,0,0.02199105594261639,0,0,0.0031409370890878095,0,0,0.04419408749921353,1,0,0.04146210452234358,2,0,True,False
I honestly believe you are a sock puppet! (thats how wiki admins judge people you know based on a single impression!),1,0,0.4065147559394996,0,0,0.012128965922860056,0,0,0.05523438814371894,0,0,0.0037894484930158143,1,0,0.1366102625793978,0,0,0.013430081555204127,2,0,True,False
"the category was unnecesary, as explained in my edit summary. Your threats are disgrace to wikipedia.",1,0,0.0898964628931823,0,0,0.005434339858226917,0,0,0.01918781518415081,0,0,0.0016826927907141256,0,0,0.021105647340575472,0,0,0.003042858414780389,1,0,False,False
"I think there should be some form of screening process here, that keeps them out. They shouldn't even be allowed to use the internet and fill it with their queer things like porn and what not. That Curps person was being a bastard, he's probably the leader of the homo wikipedians.",1,0,0.2955652457081137,0,0,0.0020485696821861956,1,0,0.09797063190393715,0,0,0.0015052134550555393,1,0,0.08287775198045509,1,0,0.01368019031054088,4,0,True,False
"Remember remember, the fifth of your mother The truth is on to you, neocon scum! You are being tracked and watched! You will be brought to light! Viva la revolución!",1,0,0.4573025992952322,0,0,0.015390177983342615,0,0,0.18397129685058108,0,0,0.011915520819054467,1,0,0.21367185172030712,0,0,0.029244056990305075,2,0,True,False
Ridiculous It's absolutely RIDICULOUS how long and detailed this article is. This is why Wikipedia is laughed at and why teachers won't allow Wikipedia to be used in schoolwork 1)the |diots writing this article are trying to demonize certain groups and 2) they're trying to revise the facts of the incident to make it seem something that it wasn't.,1,0,0.035986358118786435,0,0,0.0009633819477625011,0,0,0.010022662894283139,0,0,0.00045393162227049395,0,0,0.008172516661688355,0,0,0.0017387261824435875,1,0,False,False
"Hope he dies Now this Atheist filth's wife has gone, he should follow soon and give us all a rest from him Paedophillic behaviour.",1,0,0.27060942628086876,0,0,0.007464974600657746,0,0,0.035240303580351934,1,0,0.0032833943270930894,1,0,0.08316696889792732,0,0,0.026049911125538085,3,0,True,False
"I AM SUPERFAG, FAGGING UP THE INTERNET FOR ALL TO SEE! (talk)",1,0,0.04255429181879253,0,0,0.002364685416094688,1,0,0.017849767190662134,0,0,0.0022684105463823493,0,0,0.007459445392288326,0,0,0.0034507647011820038,2,0,True,False
"Shoo! Shoo, you silly, cowardly little person. Go away and obsess over whatever it is you normally obsess over. You appear more irrational, unhinged and ridiculous with each post. It was amusing for a while, but now grows tiresome. Shoo!",1,0,0.47163747668302153,0,0,0.007525523469406138,0,0,0.06265696120818556,0,0,0.00530670490504934,0,0,0.12191795064347191,0,0,0.00884632334604941,1,0,False,False
""" let's see, how many times he has used the f-words with various lies, and I've got no apology from the gross offender. However, you say that the quite fit label for him is the same as his """"fuckism""""? Not worthy to listen to. Advices are enough from Baseball Bugs so far, indeed. I have a valuable lesson about some of human nature from Roux's behaviors, so I'd rather read books of good maxims in Chinese.Caspian blue """,1,0,0.030407126549848756,0,0,0.0015198217613537474,0,0,0.008122541977141209,0,0,0.0008057623135323356,0,0,0.00620154384036516,0,0,0.0031944817894058153,1,0,False,False
should be changed at all. The current wording is fine. And sign your bloody posts next time you moron. ~Suicide Bomber~ 23:00 25 Nov 2006 (UTC),1,0,0.3019024779854516,0,0,0.00870914935483951,0,0,0.07506161035975958,0,0,0.0061424577927749,1,0,0.09868772978301651,0,0,0.006264738920579696,2,0,True,False
", 2 August 2012 (UTC) Lol not gonna help anymore... Penis Brown did his (blow)job... 23:08",1,0,0.4453749187133246,0,0,0.008578215242734383,0,0,0.11117942499502793,0,0,0.0025875032843043016,0,0,0.045018858696164614,0,0,0.007164693550558729,1,0,False,False
""" """"Arguing with idiots: It's like playing chess with a pigeon; no matter how good you are at chess, the pigeon is just going to knock over the pieces, crap on the board, and strut around like it's victorious.""""""",1,0,0.4370456761465484,0,0,0.0057514107810341265,1,0,0.11413914589334179,0,0,0.003240398210414485,1,0,0.1200556810617586,0,0,0.009008635800133929,3,0,True,False
"You can block and block and suck my cock but nothing can stop freedom of speech. In the end, America wins. We always do. Ask Saddam. My sockpuppet army is on the march. 02:13, 30 Mar 2005 (UTC)",1,0,0.4043851511655555,0,0,0.021916109052841082,1,0,0.3180690168728425,0,0,0.0018126695513239364,1,0,0.1523510440304139,0,0,0.013922920333742013,3,0,True,False
Stop blocking my usernames I am the username vandal. If you don't stop blocking my usernames I will find out where you live and hit you with railway sleepers. 213.205.234.222,1,0,0.3158622927665187,0,0,0.017490190465702472,0,0,0.08042676755572882,1,0,0.03380283275914242,0,0,0.0799207707084883,0,0,0.021049862117110588,2,0,True,False
Cunnywafts Nothing but a group of mediocre cunnywafts,1,0,0.11305859402454058,0,0,0.004362685083106662,0,0,0.02999582546048421,0,0,0.0019280397830825878,1,0,0.03534714877632692,0,0,0.005932086610803072,2,0,True,False
I wouldn't hold your breath. The guy is a complete tosser,1,0,0.3914798877953458,0,0,0.006100515006503416,0,0,0.06106283877986338,0,0,0.002425106285433175,0,0,0.1379525386553877,0,0,0.010129907147539165,1,0,False,False
because i didnt do anything wrong in the first place..you accused me of doing something i didnt so i thought i would just in spite..but harrassement is absolutely pathetic..talking crud.,1,0,0.14417340944808973,0,0,0.004292635179293412,0,0,0.041625560151138566,0,0,0.0017273245652464045,0,0,0.029439633510335052,0,0,0.005473032906528832,1,0,False,False
""" LMAO. You are complaining about what I write on MY OWN TALK PAGE? The only """"mediation"""" necessary is for you to cease reverting attempts at correcting your poor use of the English language, and to cease categorizing a whopping TWO EDITS as an """"edit war."""" 68.81.192.142 """,1,0,0.11059068367128215,0,0,0.004163655769480901,0,0,0.020830976135738834,0,0,0.0016636006956927652,0,0,0.0297257048619306,0,0,0.004127484185596932,1,0,False,False
"I believe that you should include in your discussion of I-95 the fact that only gays enjoy studying/discussing it. Real men prefer to talk about things like titties and butt sex, but the latter only in a negative way 'cause its for fags.",1,0,0.21669482426320483,0,0,0.0034715031981746337,0,0,0.04125962778615833,0,0,0.0017400411658603297,0,0,0.01196083144946689,0,0,0.005446608437335483,1,0,False,False
You are absurd. You are defending a page of narendra Modi who is considered as a mass murderer. Why do'nt you go to Gujarat in India and talk to some people before titiling my edits as 'Vandalism',1,0,0.19825999469343697,0,0,0.010140931988215798,0,0,0.03551384441314976,0,0,0.0028768635203480137,0,0,0.08562664272484645,0,0,0.010814741354811464,1,0,False,False
""" There are no personal attacks. Just me pointing out that you are a really lousy judger of reliable sources. If you think that a source which claims Evanescence is gothic rock is reliable enough to put Evanescence in the List of gothic rock bands, then you really should not edit the page """"List of gothic rock bands"""". You obviously don't have any knowledge of the scene if you can not hear the DISTINCT stylistic differences between gothic rock and heavy metal. Also, you act like a pompous asshat. Stop that. """,1,0,0.0751104454189867,0,0,0.0030689744888900417,0,0,0.027939034445099944,0,0,0.0014752652051365034,0,0,0.04711320942919362,0,0,0.0035085919735080005,1,0,False,False
"This has nothing to do with the article, but I f*ucking love Paul Miller's late show. Just had to say that, lulz sorry.",1,0,0.012427668736789256,0,0,0.0015303120471526026,0,0,0.010479561942363706,0,0,0.0005612360290585357,0,0,0.00868990695062447,0,0,0.0036949346860664875,1,0,False,False
"I agree with IR, seen it at my highschool. It was used sarcastically about the biggest 3 gay guys until their senior year when they came out together... one was upset that no one was suprised, they thought they would shock the school!",1,0,0.08596248400660898,0,0,0.0026165145511779916,0,0,0.021443672522903925,0,0,0.0011633659614786835,0,0,0.037241439292928835,0,0,0.012895305760527413,1,0,False,False
What the f*** do you want at my talk page. I got no time to spend with you kiddo.,1,0,0.24614276310945524,0,0,0.006883065831279666,1,0,0.07142243231117328,0,0,0.0021125258399573433,0,0,0.03062262710349947,0,0,0.004587346247124579,2,0,True,False
