comment_text,true_toxic,pred_toxic,prob_toxic,true_severe_toxic,pred_severe_toxic,prob_severe_toxic,true_obscene,pred_obscene,prob_obscene,true_threat,pred_threat,prob_threat,true_insult,pred_insult,prob_insult,true_identity_hate,pred_identity_hate,prob_identity_hate,num_true_labels,num_pred_labels,is_true_multilabel,is_pred_multilabel
Taylor Swift Album Todelete the names ESHERANN and GarLighbo from Wikipedia the can not have guest appearance they must be Hall Of Fame singers to delete all the names no guest appearance was a mistake with ESHERRAAANNN and read all the messages READ and do never give your own kidding interviews you kidding joke Taylor Swift understand READ THE MESSAGES all READ ! To delete all about TiMc and debut too and all and to delete all and submitting comments FaceBook and Twitter too with your name nothing to do gave you the chance to be the wife you have to do that girls got the chance like you can not have that all impossible against the LAW and JUSTICE and Supreme Justice Court USA understand and international justice of human rights you worked and working against th rights you all and your family to delete all understand and STAY AT HOME ! There is no American Music Awards you kidding joke ! Stay at home ! understand !!!!!! You are the first working against the messages you are sick and disturbed i ruin your life and your future and you the rest of the life you got it all what was that ? Victoria Secret event ? What does it mean ? STAY AT HOME ? !!!!! STAY AT HOME !!!!!!!!! Do you understand me you bitch and you bitch Andrea Swift what did i tell you and Scott Swift and you all STAY AT HOME she is sick Taylor Swift Stay at home ! INTERVIEWS ! in front of the cameras Taylor Swift and Family Swift you got it all interviews and to delete all the names from the sites and movies and videos and pictures and all to delete all understand me all and new clean Wiki all new and all to delete and the interviews ! NOW has the meaning now ! NOW ! you got it two weeks ago interviews about the KIDS and MathGrGR and all and all the names to talk about and all are jokes and my FANS and read all the messages READ all the messages Read all the messages Read READ READ READ READ READ READ READ all the messsages you are sick and disturbed the whole family and Scott Borchetta i fuck you in pschiatry you are fired and going in psychiatey read that all i fuck you you bitch that is promiss who told you VIctoria Sicret what was your possition UNiversal you are leaving RESTAURANT now leaving i fuck you bitch understand ! Listen bitch i am crazy you are working around the clock against the messages you bitch who told you to go to Victoria Secret.... Faschion what does it mean you bitch November 7 you got it all to stay at home too what do you doing on the event you bitch game is over and when i am telling you to stay at home you bitch that has the meaning to stay at home do you understand me you bitch who told you to go on Victoria Secret who told you that you bitch and you bitch Scott Swift and Andrea Swift who told you that ? what does it mean you family Swift and you all there is Scott Borchetta there go away you are fired in the Media you have no licence more and you have to leave Machine now you got it i put you all in psychiatry the rest of the life do you understand me you all and you Taylor Swift i put you the rest of the life in psychiatry what does it mean you bitch Victoria Secret ? event to stay at home has the meaning to stay at home YOUR parents and you are leaving now the media and going to a ranch forever i fuck you the rest of the life you bitch what does it mean to work against the messsages you bitch TO STAY AT HOME HAS THE MEANING TO STAY AT HOME do you understand me you bitch THE ACTORS got it i kicked your ass forever i fuck you bitch what does it mean to work against the messages what does it mean you bitches and you bitch Taylor Swift and in front of the cameras to stay and talk about all messages you got it in front of the cameras you bitch can you not read you bitch can you not understand americanish can you not read and interviews too was a mistake to take somebody from a casting show to the productions that is not allowed LAW to cut all and release the RED album and the interviews EDSHEERAAN is disgusting he is a casting act and he can not be on the producttions who´s idea was that looks like yours you bitch and your games read all the messages again and STAY AT HOME has the meaning STAY AT HOME you bitch do you understand me you bitch all to release and what does it mea Victoria Sectret event can you not read you bitch STAY AT HOME STAY AT HOME STAY AT HOME STAY AT HOME STAY AT HOME i fuck you bitch interview and you all dropped me in the situation i am waiting for somebody with ID to go you bitches and you bitch and your games what does it mean Victoria Secret event and a model diss you answer the model she is a joke she is a only catwalk model a joke and not my level to diss me understand you bitch interviews and what does it mean when i am telling you STAY AT HOME STAY AT HOME STAY AT HOME and what do you doing event British Got Talent and X-Factor what is that ? what kind of shit is that ? what do you doing ? and the concert what,0,1,0.9807135611792046,0,0,0.06778392386016946,1,1,0.9499482702458065,0,0,0.00823709498064144,1,1,0.9365897851286211,0,0,0.030939120564995082,2,3,True,True
"What? I ain't making no personal threats homie, I can do whatever I want. Stop acting all hard like you going to win. Grow Up and let me handle my business. - 14 July 2006 - 9:11 - Friday",0,1,0.5455638962788507,0,0,0.007625334940122792,0,0,0.11320974155706529,0,0,0.005788519484243395,0,0,0.14671787747916995,0,0,0.008527149785542892,0,1,False,False
Hi Luke's Ass. How you doin' ?,0,1,0.8954956843819872,0,0,0.047798147582268934,0,1,0.8867721920644762,0,0,0.016816454149713313,0,0,0.45921855225325864,0,0,0.04483410569049436,0,2,False,True
STOP IT THIS IS THE WIKIPEDIA. STOP INSERTING YOUR RIDICULOUS POV. ~CaliforniaDreamlings,0,1,0.5219964694802001,0,0,0.003946131766633702,0,0,0.05130489027238524,0,0,0.0017092959081359382,0,0,0.042665868391688413,0,0,0.004528265987791965,0,1,False,False
""" Disregard Might I add that he started it? Read the comments on my talk page and you'll see, if not check HIS history. Iw as being nice and giving tips to him. All of a sudden he attacks me and calls me a vandal. It was in my defence that I retaliate back. You'll also notice he hasn't deleted the message I left on his talkpage thus making me look bad. If anything you just don't get the gist of what he is trying to do. He reverts my edits from the page without explanation. So in other words he is an asshole and you'r praise earns little weight on Wikipedia. I have a right to defend myself. And my comments are not uncivil merely strong criticism. He's an asshole because he acts like a retard. Talk Contribs """,0,1,0.5203092619752804,0,0,0.004742929006204639,0,0,0.2135484398268034,0,0,0.001963454219074004,0,0,0.20184690776836617,0,0,0.004332343833287625,0,1,False,False
Yeah.... celebrate. You have very little reason not to now that you got rid of me while you are still free to do whatever you want. I hope that your own consciousness will be your judge and the editor you blocked me unfairly.I hope you all have terrible holidays like you made mine.I dont want to be part of this in any way.,0,1,0.5519276710448924,0,0,0.0156256487057306,0,0,0.09924671672946729,0,0,0.009485391590046313,0,0,0.15795100031862666,0,0,0.015778549272584815,0,1,False,False
"Stalking I asked you to stop bothering me. You then posted more drivel on my talk page. Unlike your cowardly 'running off to teacher', I'll give you fair warning - add anything else and I'll involve an admin to have you stopped. You are an obsessive, little weirdo - go away.",0,1,0.6488205739393413,0,0,0.02325507269024236,0,0,0.17898991122804603,0,0,0.015536918476234497,0,0,0.38916810692299136,0,0,0.018171972624205508,0,1,False,False
""" Peridon... i had a good feeling about you. you are not like the other wikipedia """"snitches"""". you are different. dont sell yourself out to being like """"them"""". this is not the way to gain self respect. you know im not a sock. dont get sucked up into their little games. I will pray for you because i know there is more to you then this spi crap. you know you are much better then that. and you know you can contribute alot more to this life then trying to catch """"socks"""". you said that papphase is like you. No that is not true. Papphase is lost in his own thinking. you are much better then that. done settle for being """"like"""" papphase. i wouldnt want to be like him. he is a very misearable and unhappy being who needs to make others feel less then equal so that he can feel important. i pray for you. """,0,1,0.6429138450756314,0,0,0.006530795073543326,0,0,0.20455367070056962,0,0,0.005905158998348619,0,0,0.2982330906439422,0,0,0.02248549286467074,0,1,False,False
"lol = Blocked! yeppers! I basically made a fool out of you and Hybrid though. I can't believe you both believed all that sappy garbage I was giving you. I could have kept tricking you as by not confessing then I told my self (make a fool out of them or stay lonelyboy and keep tricking them). I chose makign a fool out of you. While it didn't go necessarily as how I planned. Since, I am leaving for vacation tomorrow morning, I was going to go in and vandalize your pages just before I left, you two were pissing me off so I just gave it away early that I was making a fool out of you two. Basically because you two are so damned gullible and got in some of my other enemies on it, Charlesknight and MathewFenton, I amde a fool out of them two. Anyways, I had some extra editing to do on the pages I liked so I came and made those edits. I really don't need to come here much as there isn't really anything I am interested in. However, when I want to come back after I come back from my vacation, I can do that very easily. Anyway, later suckers. Oh by the way YANDMAN, I love you. lol you dumbass. And Hybrid, you're sweet. LOL, You gullible fatass! Yandman thinks I don't have a static IP address. I am thinking about unhooking it tonight just to come back here tomorrow and vandalize his page to show him what a dumbass he is and how I can come back whenever I feel liek it. D",0,1,0.6217512742624038,0,0,0.0060130522148969965,0,0,0.30336884398212605,0,0,0.0061104679269641474,0,0,0.30770194346898533,0,0,0.01102533648830005,0,1,False,False
Perhaps you should return all the things you maliciously deleted if you ever want to get beyond being a dope ass anthropology student.,0,1,0.5963447951851192,0,0,0.02276673002805142,0,0,0.36237183198921186,0,0,0.015272434567940531,0,0,0.27519501102396987,0,0,0.030261724744852284,0,1,False,False
Are you really deeply an ignorant person? You do offend someone and then you are surprised why that person offends you?! If you would ask me that Канбера is offensive to you and you would ask me not to use it - I would do it with pleasure as any civilized man would do. Anyway my proposition for you to go your ancestors is actual. I will ask all the media companies to change to the official name. Then you ignorant pieces of ignorance will have no choice. To convince you - I don't want and don't have time for that useless activity. Unfortunately the only cure for ignorant creatures like you is go to its ancestors.,0,1,0.5948767054596865,0,0,0.00566673906704428,0,0,0.11411127785070696,0,0,0.00900015366137494,1,0,0.29737333608626476,0,0,0.011644692252196462,1,1,False,False
"Come on. I think you know the truth. Flewis you pulled me up on spelling, warnabool which is completely irrelevant and my faith in god. However, you never denied being a nerd/loser. Now you can listen to me and change or be in your usual stubborn attitude and just continue your miserable, worthless life.",0,1,0.6320088199494956,0,0,0.014977549394711319,0,0,0.10680478191985482,0,0,0.013070402589538795,0,0,0.2656421283010578,0,0,0.008001483462534946,0,1,False,False
""" I like how you are supposedly enforcing """"anti-personal attack"""" rules while you call people trolls. """,0,1,0.5738627788333973,0,0,0.016327053736093788,0,0,0.11434023068408819,0,0,0.005260998294382434,0,0,0.18987059926787336,0,0,0.03422032292345149,0,1,False,False
hey wats up people,0,1,0.5217814827483471,0,0,0.04172701711962259,0,0,0.21429039295059177,0,0,0.004928555476287308,0,0,0.36059649838217384,0,0,0.03413087934618082,0,1,False,False
Troll Stay off my Talk Page,0,1,0.5694547712389568,0,0,0.013738817938360565,0,0,0.06504119954590533,0,0,0.002367577546578094,0,0,0.03144759792141899,0,0,0.005148914358082404,0,1,False,False
"I just wanted to say one thing.... Clinton does it, he's a white christian and his victim is jewish, he gets applauded. Spitzer does it, he's a jew and his victim is a white christian, he cops nothing but criticism. Some of the old racist nazi muffin ideals still there!211.28.41.32",0,1,0.5316565706375219,0,0,0.0057030461157390215,0,0,0.06283980172096187,0,0,0.0017630299683092736,0,0,0.146544676922967,0,0,0.12605680528719374,0,1,False,False
Helomg wtf did i do???????p,0,1,0.5716678012921778,0,0,0.015347243704244545,1,0,0.2678009718989205,0,0,0.00230293010422679,0,0,0.03545220380340933,0,0,0.0061470268695821536,1,1,False,False
"Some helpful advice ) Look shithead, why the fuck did you delete my redirects—clit rock and butt rock? They are perfectly synonymous with the names of the articles they redirected to. Of course, you must be one of those musically ignorant philistine faggots who seem to crawl all over the Internet. Tell you what, I'll give you some helpful on how not to be such a retarded poof: Find a way to go back in time. Go back to the year when you were an infant. Go to the house you grew up in. Tell you bitch-ass mother to not keep dropping you on your head. Tell that ho that because of her, you magically developed symptoms of Down's Syndrome as you grew older. So much so that these you have to become a mindless vanda-fight admin-gnome on Wikipedia cause that's the only productive thing you can do. I hope you don't take this the wrong way. I'm just trying to help somebody with far less mental facility than I. Best of luck with your future, and remember that thanks to medical advances Down's syndrome patients are slowly getting integrated into normal society. So there's hope for you yet )",0,1,0.8938014852611036,0,0,0.021047395505661096,1,1,0.7292104702955979,0,0,0.009472819650307147,1,1,0.5571104679205743,1,0,0.030119732582850077,3,3,True,True
Your mouth says stop but your eyes say keep goooing!,0,1,0.6727126549969089,0,0,0.01700778679770781,0,0,0.16533294540959792,0,0,0.00526687654664349,0,0,0.24925340223555634,0,0,0.012653712481139364,0,1,False,False
""" April 2008 (UTC) OK, heres the thing, i dont really have a problem with u all that much, but when ppl give me shit that is no matter of theirs (how thing whole thing started, on the Metallica page) i do get really pissed off, and i know u can understand that, yes we do all have breaking points, mine happens to be a little weaker then urs, ill be the first to admit that. and the whole metal thing, i do know abot about metal, ALOT, but im happy that u were not making an attack on me in that area. but heres the thing, ill admit i went too far, by a mile but now im suggesting the end of this, u can insult me and ill insult back twice as bad untill be are both out of words and in the shit with the rest of wikipedia, but all in all that wont prove anything, after all we dont even know each other in real life and real life is where the real problems are. sorry for the bother but theres nothing wrong with abit of defence here and there, and i do talk shit about ppl who deserve it, and thats why iv been doing it to u, because i did think u deserved it, and no body has kicked my arse and its not gonna happen any time soon, im not stupid, i know where to stop and think now is a good time for that. whatever u think about this whatever, but im stoping, nobody won, theres nothing to win. now im gonna get back to real life. cheers. 00:44, 15""",0,1,0.5644114749420583,0,0,0.002301628180404785,1,0,0.22319376359895637,0,0,0.003153587391962247,0,0,0.03723598440663701,0,0,0.0077792317453713134,1,1,False,False
"At least I'm trying, your M.O. basically seems to be an asshole to people who are trying to contribute. What have you done?",0,1,0.5602659039993626,0,0,0.016956684705658562,1,0,0.4245909399969368,0,0,0.0024234755548796813,1,0,0.3907099326071988,0,0,0.006836560752326404,2,1,True,False
"You must think I'm a pestering loser, right? -ML4E",0,1,0.7762984596934233,0,0,0.014929909831421426,0,0,0.06864710157638984,0,0,0.011777774339389308,0,1,0.5507631147844805,0,0,0.0145152589739844,0,2,False,True
"Breaklines and undo-ing stop editing every footballers page and putting < break lines after every positionm its never been done like that and your dumb way isnt going to change wikipedia. Also stop undoing peoples edits you dont own wikipedia and you dont have to take away someones work of editing, so grow up and stop ur useless poor break lines which again is very annoying and looks untidy.",0,1,0.6961397365627272,0,0,0.02095514045024318,0,0,0.17484128232090548,0,0,0.006737042055818315,0,0,0.3050235617701533,0,0,0.01707591695609427,0,1,False,False
"""Instead of """"who the hell do you think you are,"""" try leaving something civil like """"Why do you keep reverting my edits?"""" """,0,1,0.7470491298261739,0,0,0.015252436311124676,0,0,0.2173883820616251,0,0,0.006647712971831615,0,0,0.2716628430026051,0,0,0.014689840290997002,0,1,False,False
voidid or whatever his name is. hey voidid called me a nobody. so screw him.and he was rippin brock lesnar. i dont go on his gay steve blackman article and take the piss out of him do i?,0,1,0.8418600559998158,0,0,0.014087506222223121,0,0,0.4208906479447009,0,0,0.002982780343030323,0,1,0.5001696278023369,0,0,0.06630654748098658,0,2,False,True
"Bayard, you are a winnerr!!!!!!!!!! yipeeeeeee! You dare to defend the CCP, you punk?",0,1,0.5877165549316732,0,0,0.021210646995029694,0,0,0.07462032427455573,0,0,0.00727369998669825,0,0,0.3001291065751605,0,0,0.021624369250217424,0,1,False,False
You all have no life.,0,1,0.5360566057055173,0,0,0.032060537052075705,0,0,0.07279570904611965,0,0,0.005656037929046128,0,0,0.17139213850495014,0,0,0.013884682121073575,0,1,False,False
"Animate Feel free to erase this afterwards (because I don't know if wikipedia has a private mailbox system). You're right, the admin Animate is a faggot who needs to go get aids and die. Eat a sausage and choke on it. His monitoring of the Channon Christian wiki is horrible by all means. Something tells me that he's a black supremacist who would do anything to make an article look good for his race.",0,1,0.6740583065459204,0,0,0.005806140322600916,1,0,0.169645452156021,0,0,0.005789109267975949,1,0,0.29848925185665615,0,0,0.03735541029288487,2,1,True,False
"Gam, keep your CRAP off my Talk Page Your KKK style rants are NOT welcome. Best wishes,",0,1,0.5504797330488066,0,0,0.010557469231405534,0,0,0.17529192142686012,0,0,0.00365335786569437,0,0,0.0455444807227371,0,0,0.005097250469314054,0,1,False,False
"Might want to point out experts 99.9% of biologists with PhDs many of who have the same god, accept evolution. Jist because he is stupid or lies doenst change the truth!203.192.91.4",0,1,0.6931021736013864,0,0,0.0036063703209666662,0,0,0.08442138233837253,0,0,0.0017145940715284742,0,0,0.13569043304477799,0,0,0.01004846455103445,0,1,False,False
"And Sinneed, you and your brethren need to be 'attacked', as you put it. Call it a challenge. Your conflict resolution skills are abysmal, and you refuse to ever question your conduct. The only option left to me is to try and take you down a peg. Your ego is prohibiting you from learning how to behave properly. So let's inflame that ego of yours until it pops. That's my approach. It's for your own good, but more importantly, good for Wikipedia. People like you are holding things back, and I don't mind telling you.",0,1,0.5864340011908203,0,0,0.01021233667249953,0,0,0.10706333682303062,0,0,0.011371746536138396,0,0,0.218752144754062,0,0,0.014134305592371738,0,1,False,False
"Hi there. In case you aren't a robot, stop sending me shit messages and instead check my edits. I am the copyright owner. You must cease and decist from distributing my content.",0,1,0.588900399628991,0,0,0.015369894734741872,1,0,0.16479604631537548,0,0,0.007085295260038273,0,0,0.08222957259831212,0,0,0.008112799509586096,1,1,False,False
"Nacreous cloud article I'll edit whatever I damn well please, whenever I damn well please. I don't care what you or Bill Connolley have to say about anything. By the way, you're the moron.",0,1,0.5908665038072869,0,0,0.008977144679986032,0,0,0.2676328472718197,0,0,0.001384634647601809,0,0,0.13328153516863214,0,0,0.005855340376792555,0,1,False,False
jesus christ get a life man,0,1,0.5550435066383558,0,0,0.02515500540473103,0,0,0.2802339486825835,0,0,0.003829887638301031,0,0,0.16412071735914785,0,0,0.03552538224700622,0,1,False,False
"You obviously didn't read what they are writing, or you're just someone who doesn't care. I'm trying to work within the policies and every time I turn around one of you jerkwads pulls another thing out of thin air because you don't make any of this crap findable in the first place and use it to beat people over the head for your own sick amusement apparently.",0,1,0.5064015421040141,0,0,0.005184896980642691,0,0,0.15880745879108493,0,0,0.0048726090926003215,0,0,0.2004164592002413,0,0,0.013798933127060336,0,1,False,False
"bad behaviour by masters of puppet: acting like a dictator is unacceptable and you desrves to be told off Who do you think you are. you're the one not learning . you acting as bisased prosecutor for tennis expert. you refused to review evidenve and have made no effort whatsoever. you're suppose to read rodlaver, tennis statistics and jimmy connors for the last 6 months. As far as i'm concerned you deserve to be insulted . you behaviour is unacceptable. as far as l'm concerned wiki rules should not be invoked to protect bad behaviour and that's what your doing. you failed in your duty and have no right whatsoever to criticise when you don't do your job. ie read the evidence against tennis expert. i will not be shut by silly rules invoked by you to protect yourself from critcism. you fail to addrees any criticisms of youself and your behaviour; inciting wiki rules is unacceptable. proper behaviour is what counts and if you fail you will get told off, whatevever wiki rules. caling you a dictator is an accutrate description of your behaviour. your suppose to act like a proper judge and you have failed to do so. so look to your own behaviour before avoiding the issues by citing wiki rukes. don't expect any fancy blue things from me; i'm handicapped and can only type sentenances; i use my keyboard like a type writer and nothing else jeffreyneave 30 april 2008",0,1,0.5348663877297689,0,0,0.006911471345209299,0,0,0.0950229862007292,0,0,0.010951587685734203,0,0,0.2518051358054176,0,0,0.010396341816644837,0,1,False,False
"read this.. im gonna troll you forever and ever and ever, and nothings going to stop that.",0,1,0.651481044320227,0,0,0.017348887428929725,0,0,0.1250702453062406,0,0,0.026278771990923943,0,0,0.14798044244097608,0,0,0.02011087930144628,0,1,False,False
"He's gay. Trust me. Really, really gay. ****",0,1,0.8389167257744466,0,0,0.02013151909435312,0,0,0.12333371441215973,0,0,0.0039585404750517115,1,0,0.2411811548623697,0,1,0.5305719701572753,1,2,False,True
", 1 June 2009 (UTC) Picking fight Yeah, you're making yet another threat based on the utterly pathetic authority you've got as Wikipedia Administrator. What can one make of this? You see, I'm fervently hoping that you confirm my thesis that you are a fool. You can fulfill my hope by banning me. You are misremembering your earlier threat to delete. I suggest looking at talk page for Buckberg where these silly threats are on record. Why can't you now recall this?? Are you fundamentally dishonest to yourself, or only to me?? 06:47",0,1,0.5638153536813196,0,0,0.006915756961506199,0,0,0.05455667663353103,0,0,0.005921090703776381,0,0,0.20289295615729014,0,0,0.010647762038277815,0,1,False,False
"Actually no. However, I suspect people have shown you these links before: Wikipedia:Civility. Wikipedia:No personal attacks. meta:Don't be a dick. You really need to read them. — Particularly meta:Don't be a dick This particular bit was, if I'm not mistaken, written particularly for dickhead admins such as yourself. There is an advice to blocking admins page where 'Don't be a dick' is suggested to the blocking admins. Funny thing. Which you have so clearly shown yourself to be. (A dick) Just a suggestion, Bunchofgrapes..a little introspection might be in order here.",0,1,0.7573985769176087,0,0,0.010805352242747677,1,1,0.6180840298808211,0,0,0.002263953545708584,0,0,0.3685427328420895,0,0,0.005597739834034456,1,2,False,True
Christian XXX What do you mean citations? The guy is all over gay porn and always been active in it. I provided one of hundreds of links showing the release dates within the last 2 months of his gay porn so whats your problem. Why are you undoing it? That vendor link you provided me does not demonstrate anything. All I see is just a list of recent gay movies. Why are you focusing on his gay work? The intro just said he was known in gay porn as Maxx Diesel at the beginning of his career. It doesn't really suggest that he stopped doing gay work.,0,1,0.6809003730892836,0,0,0.005752475239334323,0,0,0.08010795847580038,0,0,0.0017644201550120512,0,0,0.14037299400014833,1,0,0.21173496390794969,1,1,False,False
